,评论
0,"交通很方便, 性价比很高, 有儿童乐园和很多鸟类, 有鸟类的表演, 还可以喂食, 大部分是, 块钱一次, 很有乐趣, 小朋友超喜欢, 玩的开心, 涨知识哦"
1,"说是说游玩, 小时, 如果是带小宝宝去的话, 个小时是不够的, 里面有几个互动环节, 喂喂鸟, 再去儿童乐园坐坐估计时间就不够了, 园子不大, 相对于动物园来说, 交通没那么方便, 大多数都是鸟, 也有河马和鳄鱼, 带孩子逛逛是不错的选择"
2,"带幼儿园年龄的小朋友很适合, 如果不怎么看表演的话刚好一天参观完, 就是交通非常不方便, 都是开车去, 不能乘坐公共交通"
3,"可能是园区交通不是很方便, 所以游人相对较少, 园区能近距离观赏各种珍稀鸟类, 工作人员服务态度很好, 值得游玩"
4,"来广州旅游一定要提前看看这个攻略, 非常推荐长隆国际大马戏, 现场看真的很需撼, 节目很精彩刺激, 很佩服和感谢, 这些马戏团表演的小动物和专业马戏人员, 景点名, 长隆国际大马戏, 交通, 乘坐广州地铁, 号线到汉溪长隆站, 门票, 平常成人, 元, 节假日会贵一点, 玩法, 长隆国际大马戏是在晚上开场, 所以可以安排白天也在长隆游玩, 长隆水世界, 长隆欢乐世界都是不错的选择, 累, 区内都有穿梭巴土接驳, 很方便, 晚上住长隆酒店就不要折腾, 明明白白安排了一天的游玩, 哈哈, 推荐理由, 长隆国际大马戏拥有全球最大的专业马戏表演, 从最初的世界马戏荟萃集锦, 到各种创新发展的顶尖马戏, 引, 领世界马戏新潮流, 旅游, 提早入场, 座中间的位置最高, 正面的视觉更加震撼"
5,"为了坐通道前排, 去得早, 等了筛龆嘈∈, 节目还是可以, 看完还可以去坐交通车送到地铁, 一定要坐中间通道, 会有巡场, 是在正面, 但是通道在位子后面, 巡场时还要转过来看, 不方便啊, 所以带娃首选通道第一排, 偏一点都]关系"
6,"预订方便, 取票也方便, 剧场交通也挺不错的, 节目水平很高, 观赏性强, 大人小孩都适宜, 早点进场, 可以选择比较好的位子, 物有所值, 值的推介"
7,"广州长隆大马戏表演, 惊心动魄, 表演花样齐全, 园区交通安全便捷, 周边环境原生态, 游玩的项目较多, 非常好特别棒, 我们特满意"
8,"非常好看, 适合带娃看, 交通也方便"
9,"挺好玩的, 人比较多, 交通也方便"
10,"交通便利, 周边美食也很丰富, 房间更是棒棒哒, 不仅有油盐酱醋, 还有准备了洗衣液, 沐浴露和洗发水竟然都是平时自己用的牌子, 超贴心, 房东更是很热情介绍攻略, 很愉快的一次住宿体验, 下次来还选你家, 玩了一天太累了没有拍房间照片"
11,"地铁直达, 交通方便, 很好玩"
12,"广州长隆野生动物园是动物世界的百科全书, 是野生动物, 珍稀动物的, 家, 也是国内目前为止最大的动物园还有些这里的地铁非常的方便交通还是很优越的, 而且里面真的很漂亮, 还是大开眼界"
13,"特别值得带领孩子游玩的一个地方, 各个动物区都是独立的, 建议游玩时候分区玩, 去的时候人特别多, 园内小交通, 缆车排队好长, 因为女儿有点小, 果断又交了, 块钱, 一家四口, 每人, 买了个绿色通道, 果然比较快, 孩子忒别喜欢熊猫和考拉, 比我想象的还要好, 瑕疵就是里面吃的东西特别贵"
14,"今日去玩了, 天气好好, 搭览车可以全程观赏动物, 又搭小火车近距离接触动物, 好, 啊, 小朋友全程玩得好开心的, 食物就有点小贵啊, 下次会再来游玩的, 交通也超级方便, 广州南站搭地铁, 号线, L隆站出闸, 地面有免费巴士接送到动物的, 棒棒的"
15,"位于广州市番禺区长隆野生动物园是五, 景区, 交通出行很方便, 地铁直达汉溪长隆站, 出口就有免费接驳车接送到长隆各景点, 很方便, 园内行李寄存大件, 小件, 这里也是全世界动物种群最多, 最大的野生动物主题公园, 被誉为, 中国最具国际水准的野生动物园, 具有全国首创的自驾车观赏动物和大规模野生动物种群放养两大特色, 长隆野生动物世界园共占地, 余亩, 分为自驾车游览区和步行游览区两大部分, 园区还拥有大面积原始生态亚热带雨林和, 余种, 余只珍奇动物, 其中包括考拉, 大熊猫, 黄猩猩, 亚洲象等各国国宝, 一天时间玩下来觉得很冲忙, 坐缆车和小火车都需要排队, 人也超级多, 月特惠一个成人可以免费带一位, 一下儿童入场, 很划算"
16,"长隆野生动物园是, 旅游景区, 位于广州市番禺区, 交通出行很方便, 地铁直达汉溪长隆站, 出口就有免费接驳车接送到长隆各景点, 很方便, 园内行李寄存大件, 小件, 这里也是全世界动物种群最多, 最大的野生动物主题公园, 被誉为, 中国最具国际水准的野生动物园, 具有全国首创的自驾车观赏动物和大规模野生动物种群放养两大特色, 长隆野生动物世界园共占地, 余亩, 分为自驾车游览区和步行游览区两大部分, 园区还拥有大面积原始生态亚热带雨林和, 余种, 余只珍奇动物, 其中包括考拉, 大熊猫, 黄猩猩, 亚洲象等各国国宝, 我最喜欢长颈鹿, 这里都是成群的, 很过瘾搞, 一天时间玩下来会有点紧张, 坐缆车和小火车都需要排队, 人也超级多, 月特惠一个成人可以免费带一位, 一下儿童入场, 很划算"
17,"比想象的要好, 还挺大的, 值得一去, 而且交通也很方便"
18,"交通很方便, 免费公交四通八达, 可以达到景区内任一景点, 野生动物园内有小火车和缆车可以免费乘坐, 人多的时候要排队, 不是一般的排队哦, 有时候要排好几个小时, 这时候你如果多掏钱的话, 可以走快速通道, 另外, 还有一种参观方式, 自行驾车或租车进去沿固定路线也是可以的"
19,"交通很方便, 免费公交四通八达, 可以达到景区内任一景点, 野生动物园内有小火车和缆车可以免费乘坐, 人多的时候要排队, 不是一般的排队哦, 有时候要排好几个小时, 这时候你如果多掏钱的话, 可以走快速通道, 另外, 还有一种参观方式, 自行驾车或租车进去沿固定路线也是可以的"
20,"行在长隆, 交通很方便, 免费公交四通八达, 可以达到景区内任一景点, 野生动物园内有小火车和缆车可以免费乘坐, 人多的时候要排队, 不是一般的排队哦, 有时候要排好几个小时, 这时候你如果多掏钱的话, 可以走快速通道, 另外, 还有一种参观方式, 自行驾车或租车进去沿固定路线也是可以的"
21,"动物园有免费的穿梭巴士, 交通很方便, 园内清洁卫生, 隔一段就有厕所和休息区"
