,城市名称,用户性别,评论,用户id,用户昵称,用户评分,用户等级
768,杭州,,题材不错，故事情节并不能深入人心，没有电影，打发无聊时间吧,1111241896,MZk960626046,3.5,3
769,南昌,,很好看，都想二刷,1111237113,UsT643829771,5.0,2
770,吴江,2,"不好看，狗血剧情，并不感人……
",1111226761,长生果,3.0,2
771,上海,1,电影我没看。票也没取。,1111241839,欧吼lll,2.5,2
772,银川,1,听扎心的，，,1111249153,00,5.0,2
773,宜兴,1,本来是冲着章若楠去看的，期待值很低。结果这部电影很新颖，剧情也很饱满。奇幻里又带点现实，美中不足就是结尾太仓促，留了一丝念想，是一部不错的电影。,1111245149,灬未花名,4.0,4
774,洛阳,1,"哎
说太多了，大家不信，自己看去",1111248011,你就是我的A,0.5,2
775,长沙,2,看完了“如果声音听不见”我感觉我内心更崩溃了……连一丝防备没有的哭得抽泣……电影院很多人看睡着了...但是小部分人还是坚持看完了，只能说明看不下去的很幸运，看下去的都加油好好爱自己。女主说出那句“为了责任而努力活着”瞬间泪崩了...那种从小的美好，希望，到失望绝望...到肩负责任想死都被人鼓励前行的累到后来的内心不自信再到相信再度绝望...久久都无法平静内心……就像唯一的牵挂再原本在黑暗中是一道光，而那道光也渐渐的失去了明亮，最后永远的沉沦在无尽黑暗中……真的其实抑郁的心理是两个心理，渴望解脱 内心自卑 不敢脆弱怕人指责笑话 不论什么都觉得不好 渴望美好却内心深处都是悲伤失望绝望不自信不相信……,1111249129,03洛杨Gg98,5.0,1
776,桂平,1,眼里是不要钱的，故事里的情却是要了命的。,1111228595,peach,5.0,2
777,章丘区,,没去看，弃票了,1111249119,Letong110,2.5,2
778,武汉,,.......作为一个女生 没哭,1111247623,LZY不吃香菜,3.5,2
779,深圳,2,其实电影里吉择用毛巾堵住卫生间门的情景跟我很像，所以有些累，是真的说不出口的,1111241843,ambition,5.0,3
780,郑州,2,感同身受 抑郁症女孩加油啊,1111247616,一帆美甲月月,5.0,3
781,东莞,1,好看 哭戏真的太感动了 哈哈哈隔 我一男的看着都想哭 突然之间就喜欢上了这个女主的感觉是什么样子的 哈哈哈哈 现在居然这么喜欢这个女主,1111240809,林深,5.0,2
782,太原,,值得一看……,1111249103,A媛宝啊,5.0,4
783,海西,,我认为非常好看的电影了，全程几乎都在哭，太戳中我的泪点了,1111245655,kYr382899269,5.0,3
784,青岛,,看不明白   前后不搭 莫名其妙  看的没感觉没泪点,1111226739,雪梨吖、,2.5,2
785,廊坊,,我觉得患有抑郁症的人不太适合看。,1111241805,艾可”,5.0,2
786,锡林郭勒,1,一般碰到垃圾片 多少会吐槽一番。而这部片，连吐槽的那点时间都不想去浪费！拿抑郁症打幌子骗眼泪 博同情，如果在国外你早已被以侵犯抑郁症患者人权而被告上法庭！更不要说烂到家的不成章的剧情！如果连这样的编剧与导演都可以写“剧本”拍电影，可真是中国电影文化的悲哀！连这样的影片都可以被炒到分，可见国内影迷的观赏水平是有多么的低等！（这 同等体现着文化素养与精神深度）03,1111245624,Мистер асхан 28,0.5,3
787,南阳,1,比较一般没啥感触,1111240950,7,4.0,2
788,长春,2,"总体来说很不错，我观看全片时处于一种奇特的感受中，说不出道不明。
我想说: 声音也许不会记得，但一起经历的事情总会留存在记忆里。
影片最后辛唐即将走到生命尽头时为吉择开直播唱歌的时候我哭了，成年人的泪点就在那一刻爆发了，情不自禁，莫名心疼这个男孩子。
这世上钟情的人并不多，愿我也会遇见像辛唐一样温柔的很爱很爱我的男孩子。",1111240841,小朱,5.0,1
789,西安,,989898,1111241794,雨铭n,5.0,2
790,南宁,2,好不好看我不知道，懂的人自然懂，可我不懂[苦涩],1111240944,969696,5.0,3
791,威海,,还可以结尾挺感人,1111241781,婷ting19八8,5.0,4
792,佛山,1,去见你想去见的人、所有失去的都会以另一种方式归来... ,1111240912,余七,5.0,1
793,海口,,很好看，结局不好，,1111241766,lQR855061981,4.5,2
794,深圳,,好看 值得一看,1111249010,Llosvte,5.0,1
795,广州,2,后排超没素质。看个电影又是看视频又是说话大声的！！！！！,1111245586,02,2.5,2
796,佛山,2,满分给女主的演技吧 剧情普通,1111240902,柚子,5.0,2
797,石家庄,1,直接看哭我了,1111228562,.,5.0,2
798,广州,2,不知道怎么形容 get 不到内点 感情戏也不太走心 总结：不甜，不悲、没看点、没意思，看完很懵 就这？,1111241759,九离95,0.5,2
799,宝鸡,2,一般没有说的那么感人,1111219189,hgX902807928,0.5,3
800,珠海,1,看的容易勾事,1111241752,P*豪,5.0,2
801,昆明,,她突然莫名的哭 是因为没有人懂她 心酸这么久以来 也没有被人好好的珍惜过 更感叹自己懂事以后也没让自己好一点.,1111240892,ZRm501084756,5.0,3
802,重庆,,这电影真的看起来很尬啊 都要看睡着了,1111237062,Bala玖伊,1.5,2
803,阜阳,,中规中矩还算满意,1111242994,长辰,3.5,2
804,深圳,2,有些感同身受，我觉得拍的很好，虽然有些科幻类的剧情有点不真实但是也是演绎出了现在很多人的处境跟选择，很棒91999199反正我是哭的泣不成声,1111240879,RPp414139273,5.0,2
805,滁州,,非常棒，女朋友都看哭了,1111240878,奥卡姆昂纳,4.5,2
806,苏州,2,很喜欢，，，,1111241739,打烊,5.0,2
807,深圳,1,女主小姐姐太好看了！哈哈哈哈98,1111240868,大雄不会再感冒,5.0,2
808,佛山,2,结局有点烂，其他还可以。,1111242962,A.薇,4.0,3
809,深圳,,没哭，感动而已,1111247468,GJa433137562,4.5,2
810,滨州,1,整体剧情不错。结局有点烂。总体来说还不错值得一看,1111240848,宋6,4.0,1
811,泉州,,不知道有什么哭的点，但是看完以后感觉自己跟吉择挺像的,1111242946,你的小甜甜,5.0,2
812,昆明,1,因为你的声音，我记得（生命诚可贵，爱情价更高）,1111245532,bSh167385139,5.0,2
813,重庆,,很一般，没有想象中好看,1111247458,吃不胖的雪宝宝,2.5,2
814,河源,2,不好看。这剧情很水很狗血,1111241708,南星95,2.0,1
815,广州,1,差点就哭了又差点没哭,1111225675,NINESIX,5.0,1
816,武汉,,后劲十足推荐,1111242924,乖不如耶,5.0,2
817,哈密,2,真的太有感觉了,1111237041,Block,5.0,1
818,建水县,,马马虎虎吧，,1111245503,xkJ219609712,3.5,2
819,抚州,1,有点没看懂哈哈哈哈,1111245502,封.,5.0,1
820,苏州,1,这是唯一一次看电影看一点点就看不下去的，要不是电影院有个出钱按摩椅我花了一个小时的钱我才不愿意继续看下去，太垃圾了。,1111247425,Deep・breath,0.5,1
821,深圳,1,结局好像不是那么好，要是男主没死的话，那结局可能就完美了,1111241682,Lucky.,3.5,2
822,乌鲁木齐,,为了看这部电影，我花了138块请女友吃牛排。花了68块钱买了电影票，时间还早便花了40块按摩了半小时。啤酒饮料爆米花，骗子片子烂到家！看完后，我抑郁了……,1111225657,思宇文化皮卡陈,0.5,2
823,广州,,过不了多久圣诞 新年 这些美好与温柔都会如约而至 如果你有空也一起来吧,1111241678,gwnilveyou,5.0,1
824,安吉,1,每个人都有自己的经历，也决定了各自的想法，所以希望每对情侣都能感受到对方的爱以及互相理解。愿所有黑暗都被爱照亮。祝有情人终成眷属。,1111245496,无心,5.0,1
825,广州,1,挺好看的，就是有点……,1111241676,笑笑95,5.0,1
826,珠海,2,这也太烂了，无语了,1111247291,十一月的肖邦,0.5,2
827,厦门,1,早知道后劲那么大不分手就好了,1111184856,Agoni,5.0,2
828,咸阳,,070707,1111245493,YY98022,5.0,2
829,深圳,2,遇到有史以来最烂最烂的片 没有之一！,1111242878,萌哒哒的seven,0.5,2
830,佛山,2,看完更难受……,1111240796,w,5.0,3
831,东莞,2,影片的最后辛唐也还是不在了,1111240794,LLL,5.0,1
832,惠州,,挺好看的，前面和后面都有女生哭，我坐中间排无人,1111242857,锋仔啦,5.0,2
833,扬中,2,很温暖，很感动,1111240774,MichstaBe,5.0,2
834,宜宾,,有多大的期待就有多大的失望06 ,1111245461,锦,0.5,1
835,惠阳,1,看的一脸懵逼,1111245465,大哥L,3.0,2
836,富阳,,电影给人的感觉就很好，很喜欢女主演的电影,1111242839,小曼曼巴,4.5,2
837,汕头,1,看不懂，很尬,1111245457,Yolo31a,2.0,2
838,汕头,2,非常好看，都哭了,1111237030,Deity,5.0,1
839,张家港,1,"曾经的地方，那一个地点，那一个重要的人。
灯光弥漫，星光闪烁。
你在灯光下飞舞着，广场上扮着小熊，成为了那一个重要的人，我们之间的命运就此绑定。
春夏秋冬，飞过的蝴蝶，落下的黄叶，流过的溪水，飘飘然的雪花，仿佛这就是生命。
一天又一天，一年又一年，蝉眠了，你笑了，转眼间，世界充满了光明，你的声音成为这世界上最动人的音乐。
笔记本的字里行间存在我对你所有的热爱，你带来这个世界独一无二的温暖，也带来这个世界最善良的温柔。
风轻轻吹过，亲吻着大地也亲吻着世间最美的时间。
（愿所有黑暗都能被爱照亮。）",1111247342,.,5.0,2
840,清远,,我就是一位抑郁症患者。片中有多处都很入心。看的时候没怎么哭 就很难受 有点呼吸不过来。出了片场后才哭得伤心。92,1111225648,PcR530027742,4.0,2
841,平阳,2,没有值不值得、如果你觉得值那就值。,1111237027,清酒,4.0,2
842,顺德,,本来心情不好，看了更不好，唉！,1111242825,陌,0.0,1
843,惠东,1,影片是想告诉人要珍惜吧！,1111245450,I could be the one,4.0,1
844,兰州,,天啦，给三岁小孩看的，太难看了，看睡着了，剧情太狗血尴尬了，看到中途就离开，，看不下去，,1111247324,羽i,0.5,4
845,西安,2,我流了好多眼泪,1111247321,＄【优秀】＄,4.5,3
846,包头,,大概只有真的有过心理疾病的人才能看懂吧 不然其他人只会觉得无病呻吟罢了 哭了一场 有点难受 但也治愈了不少 走的时候太着急怕人家看到我哭 发卡留影院了 也不知道有没有工作人员帮我收起来 望有情人终成眷属。,1111247315,EW-王珂,5.0,2
847,合肥,,好无聊。终于知道为啥那么多人快睡着了，这是什么破片,1111247314,然后我失去了,0.5,2
848,南宁,,爱死了楠女神,1111247311,crosszzzzz,5.0,2
849,深圳,2,不好看。。。。。,1111240736,CX330,0.5,2
850,建阳,2,还可以吧！就是结局有点遗憾,1111241610,独韵茶95吴清心90,3.5,2
851,宿迁,1,"章若楠演的太好了，太喜欢了圈粉
",1111225641,司宇轩很哇塞！,5.0,2
852,珠海,2,建议不要去看 尤其不要带女孩子去看 实在要看 带几包纸巾05 好看 ,1111226663,16Fan晓,5.0,3
853,上海,1,把我看哭了 女朋友没哭 我给打哭了！！,1111219152,安逸°,5.0,2
854,上海,,差评 为了女主角去的,1111247294,YooUU1,1.5,2
855,惠州,2,给我看傻了抑郁症谈个恋爱就好了分手就加重,1111228508,HsY,3.0,2
856,南充,,有几个片段比较感人 有的片段看的快睡着了,1111245420,vbQ180121004,2.5,2
857,深圳,2,一般般呀，害，还好,1111228504,微微91,2.5,2
858,英德,,还可以！挺好看的,1111240717,lyx凡1314,5.0,3
859,清远,2,一点都不好看,1111247278,16,1.0,1
860,兰州,2,其实我哭是因为，很多人都能扛过得坏情绪，我却输给了它！,1111247277,做回我的小狐狸02,4.0,2
861,西安,1,是烂片，但吴青峰让我觉得它能有三星。,1111242775,是陈粒的崽,3.0,2
862,郴州,1,女主的事情跟我很相似，看哭了好多次，但这部剧还是偏爱情了一点，也对吧因为这在剧中的确挺重要的,1111240703,Kill,4.5,2
863,深圳,,最近看的超级棒的电影 内容舒服 很好看 ,1111247262,刘小兜。,5.0,2
864,海口,1,不知道为什么，可能是我泪点低，一直流泪。,1111226642,阅读i,5.0,3
865,高州,2,早知道后劲那么大，不分手就好了,1111241588,Fziye,5.0,2
866,郴州,,一般般吧。 ,1111241584,l野生的大熊猫,3.5,3
867,乌鲁木齐,,一般…………,1111242764,Mercurial7kk,4.5,3
868,北京,1,哈感觉还行吧，抱着哭晕的心态看到，并没有哭，,1111247250,盛望,3.5,1
869,丹东,1,对感情的事儿 有点麻木了,1111242761,E0401585659,5.0,2
870,呼伦贝尔,1,给我哭惨了.,1111240693,DJ Becker.,5.0,1
871,泉州,2,结局都没有而且有点尴尬...,1111245391,carry,3.0,2
872,顺德,2,扎心，男主，,1111241575,微凉,5.0,1
873,沈阳,2,演员演技什么都不错 就是剧情差了点 看了开头就能猜到的那种 哭戏很好 但就是感觉没什么太大的泪点 ,1111245390,like,3.0,2
874,景德镇,2,一点都不好看 都是抖音宣传骗来的 我男朋友都看的睡着了,1111241574,Undo,0.5,2
875,佛山,1,因为你的声音 我记得,1111242755,Ti Amo,1.0,2
876,南通,2,只可意会 不可言传,1111242753,* R26ebo22m.60686068郭,5.0,1
877,中山,1,没有原因，只有喜欢,1111242746,星仔,5.0,3
878,慈利,,你去你该去的地方，我过我该过的日子。,1111240685,上头109,5.0,1
879,南昌,,差点就看哭了,1111242735,tfD312483524,5.0,2
880,北京,2,挺好看的，男主也很帅，,1111242734,Ting 婷,4.0,2
881,石家庄,,很喜欢落落，所以去看了电影，而且不管什么时候她拍了电影都会去看的。不能说绝佳，但也没有很多人说的那样不好，我是专心看完的，很多点都很感动，我喜欢那些很特别的小幽默的部分，结局不是我喜欢的，但为什么就非得是我喜欢的呢？加油哇，落酱，你永远都是我很喜欢的作家，希望你越来越好了。by the way这个电影不是小四导的哇，大家不要为了骂而骂，这样真的不好哇！,1111225619,_qqwtc1436335167,4.5,2
882,南通,,很好看，哈哈哈,1111228474,sHO596491656,5.0,2
883,顺德,2,还行吧，不是太感人,1111245366,A-lxhlgc,4.0,1
884,惠州,2,还不错，就是看的时间太晚了  蛮困9797,1111241534,.,3.5,1
885,新余,1,剧情很揪心，也挺好看的，可是结局有点遗憾,1111242717,94,5.0,1
886,长沙,2,很感人，哭得稀里哗啦,1111247210,晶华中国黄金张慧9413055180091,5.0,2
887,深圳,2,难过 耳朵里面都是后面情侣接吻的声音,1111241531,02,5.0,1
888,贵阳,,还行....,1111242714,包子lli,4.0,2
889,杭州,2,看的懂的人死去活来 看不懂的开怀大笑,1111242712,9,5.0,2
890,南宁,2,可惜没有泪点，好想找一部能哭的电影,1111225616,sica,5.0,3
891,义乌,,跟你看的最后一场电影，也许我和你都不会在见面了。,1111242710,独一草,5.0,4
892,温岭,,"还行吧
……",1111247201,wjq19930718,2.5,2
893,天水,1,真的超建议去看,1111247199,阿西,5.0,2
894,东莞,2,太好哭了…似乎被带进剧里，似乎和吉择一般也曾遇到过那束光。,1111242705,只只,5.0,1
895,深圳,2,"还不错,我们也满是遗憾",1111241522,.,5.0,2
896,武汉,2,挺好的反正我男朋友被感动了，,1111247185,@,5.0,3
897,亳州,1,特别好看，就是有点费纸巾，在电影院里都是稀里哗啦的，剧情真的挺不错的！,1111245353,Alonebぴ伟,5.0,2
898,深圳,2,不够看，结束的时候一脸懵,1111247184,会一直在吗,2.5,2
899,宜昌,1,挺好看，剧情感人,1111226618,人生如戏,5.0,1
900,平潭,1,"一般般 体验差
结尾剧情拖沓",1111226617,4C,2.0,2
901,镇江,1,感动，希望每一个抑郁症患者都过的很好,1111247176,.,5.0,3
902,长沙,1,男女主角颜值担当，故事情节有点虚假，总体感觉一般,1111245340,小小小_孟,4.5,2
903,长春,1,辣鸡电影，不好看,1111245338,无邪,0.0,2
904,广州,1,很一般而且没头没尾,1111241503,Cever,1.0,2
905,广州,1,感同身受，哭了,1111247174,happiness,5.0,2
906,广州,2,为什么有一分 为什么没有0分评价,1111240650,,0.5,2
907,温州,2,不好看没看懂,1111218977,别皱眉了,2.0,1
908,宜兴,2,催泪 哭了好几次 感同身受吧,1111247168,荷塘月色,5.0,2
909,武汉,2,一点都不好看 是我看过最烂的爱情片,1111241498,L.,1.5,3
910,陆丰,1,泪流满面，真的,1111247167,蔡头很菜,5.0,1
911,朔州,,抖音都是骗人的 有那么感动吗 刚跟对象吵完架去看的 都没感觉有多难过 ,1111241490,Tefuir0402,1.5,1
912,深圳,1,你的声音我记得,1111245324,,5.0,1
913,长沙,2,好看，让我最有感触的并不是男女主之间的感情，而是女主的抑郁症，家庭的不幸还有被室友表面维持关系背后的排挤，就像吉择说的一样，她的抑郁症没办法像别的病历单一样里面能看到坏死的细胞，电影里后来同学们都知道她有抑郁症了都不相信，不重视,1111226611,楚楚,5.0,2
914,淮阳区,,真的挺好看的，,1111245320,今T又晚睡了,5.0,2
915,衡阳,1,后劲有点大，想喝酒了,1111240630,友人822,5.0,3
916,绍兴,1,没有想到作为一个男人的我看完这部电影都能流泪,1111245316,d,5.0,1
917,芜湖,2,不错 歌很好听 公益性比较好吧 呼吁人们关注照顾一下抑郁症患者,1111245313,Rain,5.0,2
918,普宁,,"没什么感觉
",1111242651,qvO176032338,3.5,3
919,栾城,,早知后劲这么大，当初不分手就好了,1111241480,青蛙.,4.0,2
920,兰州,,好看，哭坏了,1111241479,nGh787879628,5.0,2
921,福州,1,好难看啊。一点快乐感都没有。剧情老套，结局也老套。结局感觉在哪看过？,1111228459,高冷病友,0.5,1
922,成都,2,我挺喜欢的类型。特别催泪,1111242642,"renascence,",5.0,1
923,深圳,,还好吧，emm,1111247137,yCf719427041,3.5,2
924,上饶,2,哭戏代入感很强，值得看,1111239269,叶小白,5.0,2
925,泉州,2,喜欢里面的一句话，早知道后劲那么大，当初就不分手了,1111240610,SS,4.0,2
926,海城,1,其实可以有个完美的结局美好一些7815,1111226598,.,5.0,3
927,新余,1,一分都不想给，烂片烂片，烂片之王,1111228455,年轻人,0.5,1
928,宁波,2,挺好看的加油,1111218961,犯了痴,5.0,2
929,珠海,,好看，成功看哭,1111225592,倪瑞！！！,4.5,2
930,成都,,好看  非常好看,1111245298,骆QY,4.0,3
931,同安,1,还可以吧，剧情猜的到，科幻,1111245295,小康,3.0,2
932,珠海,2,值得看后面还有20几分钟泪点低了 感觉快要窒息,1111240601,你的啊琪,4.0,2
933,武汉,2,愿所有黑暗，都可以被爱治愈……,1111245293,陈静燕（Mandy）,5.0,1
934,丽水,2,电影不重要，主要是和男孩子一起看的,1111247117,Crush,5.0,1
935,广州,1,这是啥……我裂开了，忍住看了50多分钟坚持不下去走掉了…有点尬,1111228449,WSF,0.5,4
936,长沙,1,以后没有结果的事就不要开始了,1111242597,小周,5.0,2
937,东莞,1,挺好的讲述了爱情的味道，就是后面好狗血,1111247113,Y.7-9.1,4.5,2
938,大丰,1,很感人，导演很有才，情绪代入很强，演员很到位，配音钢琴曲挺棒，原所有黑暗都能被爱照亮。,1111240594,黄桃新号码-13912655383,5.0,3
939,惠州,2,还行吧，，，,1111240593,霖霖Allen,5.0,2
940,保山,2,看完后久久不能出戏……,1111242609,pursource-王玉珏95,5.0,3
941,保定,1,早知后劲这么大，当初就不分手了,1111240592,时倾,5.0,2
942,广州,2,感觉忧郁症这一块没有给到我的点上，相比较00悲伤逆流成河，这部剧反倒没有很惊艳。,1111242613,"A 猫咪,海绵加盟，项目经理  薛丹",3.0,2
943,武汉,2,比较垃圾吧，一点也不好看，,1111228446,92,0.5,3
944,东莞,2,超级无敌好看,1111228445,哦哟,5.0,1
945,成都,,虽然有很多人说这部电影不好看，但我觉得它的剧情真的戳到我的心里，看到那段吉择转身看辛唐还在不在，结果没有人，哇，一下就绷不住了，一直哭到结束，出了影院还没缓过来。和自己心爱的人去看的，我终于感受到了难受时被人抱住，好暖好暖。,1111226587,干饭小粥,5.0,2
946,中山,2,感触很深，情侣去可能比较适合,1111240588,A～彭琳,4.0,2
947,凤台,,过程挺不错的 结局不算完美 无泪点,1111240584,少年与梦。574,4.0,2
948,昆明,1,个人意见，实在get不到那个点,1111247100,、野港,2.5,2
949,长沙,2,超级感动  一定要去看  别留遗憾 ,1111245276,A-输入中,5.0,1
950,广州,1,太难看了，无聊,1111247098,丑八怪咦呀咦呀啊啊！26242224,0.5,2
951,揭阳,1,不适合一个人看,1111242599,浪少,4.0,1
952,巢湖,,好看，很好看的,1111218950,。,5.0,2
953,南京,1,希望我家宝宝永远开心,1111247096,Evan,5.0,3
954,南昌,1,不知道咋样，我看一半看睡着了，大多都是情侣，我一单身汉，给看一半睡着了，所以就先打一半分,1111247095,_,3.0,2
955,大理,2,你过你该过的日子 我走我的路,1111247094,kmily,5.0,2
956,通辽,2,哭的稀里哗啦,1111241430,卖男装哒小菇凉99,5.0,2
957,重庆,2,非常好看，很喜欢,1111218948,95 的记忆,5.0,2
958,青岛,,结局有点草率,1111247078,cQp572248100,4.5,1
959,广州,,挺好看的，就是剧情不太完整没有结局,1111242582,依旧鸭,5.0,1
960,长乐,2,太好哭了吧。,1111247077,90,5.0,1
961,惠阳,2,如果你真的放不下一个人，没关系，那就继续喜欢，可能你会成功，可能你会累到放手，至少没有遗憾,1111242581,MiSS、Baby、,5.0,3
962,银川,2,这片子太让人难以相信了，但也有感动的地方，亲情的部分，还是很让人感动的。但是男女主的感情线，太狗血了吧！而且那个什么星球的设定太让不能相信了，感觉像动画片。,1111240464,艾美,2.5,2
963,包头,2,好看 感动01 ,1111218939,媛媛媛媛何什么03,5.0,1
964,三河,1,要是最后男主与女主在一起就好了,1111218938,99感谢经历99,5.0,1
965,天津,2,有够难看的 。。。。,1111247070,肖兔兔,2.0,2
966,德州,1,一般般吧，没有觉得特别好看，剧情太烂了,1111242571,南群德州美丽华保健师贾志伟,2.5,3
967,明光,,除了文案，真的很烂,1111225570,sif622905282,0.5,3
968,沈阳,2,"一个人去看的，泪目后劲贼大
因为你的声音我记得
早知道后劲这么大，不分手就好了。",1111247067,07,5.0,1
969,温州,1,没有经历过就没有那么多感同身受吧，那晚我也哭的很大声。,1111240556,听众,4.0,2
970,广州,1,快结局的时候被感动了03,1111225569,95利源牛仔95,5.0,2
971,邯郸,2,什么完咦……,1111242566,WTD785087885,0.5,2
972,深圳,1,我女朋友跑了,1111242565,不能再吃了,0.0,2
973,哈尔滨,2,还行吧。  结局很意外。  没有特别好看。  ,1111219105,脸脸93,4.0,1
974,淮安,2,"我看笑啦哈哈哈
啥玩意
",1111245237,Ohh,3.0,3
975,平阳,2,挺好看的 建议可以去看看,1111241394,94,4.0,2
976,北京,2,"不太好看
原先看见预告片很期待以为是讲抑郁的，而后发现融合了奇幻，爱情，融合的主题太多导致看完并不知道他到底讲了什么。
预告片是以抑郁症为卖点，但全程爱情主题高于抑郁，让人很是无奈
剧情方面有些许老套，尤其是到结局那里，那个复活套路太太太老套！！
（721572157215仅代表个人观点勿喷）",1111240541,小黄鸭,1.5,4
977,扬州,1,对方看不上我导致面基失败没看，不知道好看不好看96,1111241392,会飞的肯德鸡,1.0,3
978,长沙,1,还可以吧！啊,1111228426,YANGMINGZHE163,5.0,2
979,从化,1,快跑，赶紧跑,1111242548,tactful,1.5,2
980,成都,2,"无敌烂
一个知道自己快走了就是要主动调戏人家小姑娘，勾着别个喜欢自己的男主
和一个到别人家里爱乱翻东西，还脾气大第二次见面扔包、刚接吻确定关系就吵架逼对方留下来不留下来就分手的女主
真是为了他们100天的比生命更珍贵的绝美爱情哭泣，这段绝美爱情的珍贵回忆就是几个熊玩偶和大晚上的跳舞还就跟炫舞杀马特一样到处发射激光
nb",1111241388,穗,0.5,2
981,深圳,,好好呢90！,1111240532,QAi219195419,4.5,2
982,合肥,1,我也不会演戏 所以不评价演技 男主在医院死掉之后我就离场了 本来剧情就够俗套了如果还是happy ending的话就没意思了 我不是导演不会拍戏 但还好 我能控制自己怎么看,1111225557,FINE,3.0,2
983,集美,1,不错，爱是永恒,1111242544,王骏（清雅居士）,5.0,2
984,中宁县,2,愿所有的黑暗都被爱照亮,1111228425,牛油果,4.0,2
985,郑州,,一般般吧 无功无过 不好看也不难看,1111247046,桉eyes,3.5,2
986,烟台,2,垃圾太垃圾了,1111242543,小鲁慌慌,0.5,2
987,株洲,1,抑郁有情结…唯爱可解95 ,1111247044,湖南省陈义康复有限责任公司  陈义,4.0,6
988,玉溪,2,直接看哭了。,1111242537,JIAMIN,5.0,1
989,东莞,1,"男主活过来就牛逼了
那么女主就是男主死了发自内心的开心",1111242481,Leon,0.0,2
990,广州,2,看懂的都泣不成声，没看懂的始终没看懂,1111242534,咦啵啵,5.0,2
991,揭阳,,还好,1111241382,PVI679054111,3.5,2
992,惠阳,2,看哭了…你说好不好看,1111242518,rik-,5.0,1
993,慈溪,,结局不完美  其他都挺好,1111225555,yzt391401615,4.0,2
994,腾冲,2,还行吧，可能男朋友没有陪着看，不是那么好看吧！98 98 ,1111240516,炭烧酸奶,3.5,1
995,南昌,,好看太好看啦,1111245224,txo173984507,5.0,2
996,东莞,2,后劲这么大 早知道不分手就好了,1111240513,xxx,5.0,1
