,城市名称,用户性别,评论,用户id,用户昵称,用户评分,用户等级
671,扬州,,好看，木兰和独狼真的是太帅了呀，她们善良正直。电影里在展现木兰刚强的同时，也展现出她的柔弱的一面，木兰穿女装的那一段我很喜欢。,1106863901,林胖英,5.0,2
672,青岛,,和朋友一起看完了，非常精彩，国漫又一崛起之作，打斗很激烈，画面感十足，真的是大成本了。不多说支持就完事了,1106866145,A旭嘟嘟,5.0,2
673,北碚,,真的是太好看了~~~这次感觉导演的拍摄视角不一样，把木兰的家国情怀和自己的小情爱放在了一起。而且影片中的军师这是集君子与小人为一体的，这样的矛盾体在一人身上很少见，值得看~,1106861922,脱胎换骨1668,5.0,2
674,商丘,,很适合带小朋友一起看！花木兰替父从军的故事很让人感动，动画效果很好,1106861877,山海51875,5.0,2
675,扬州,2,好看，木兰和独狼真的是太帅了呀，她们善良正直。电影里在展现木兰刚强的同时，也展现出她的柔弱的一面，木兰穿女装的那一段我很喜欢。,1106865676,不将就6390,5.0,2
676,上海,1,花木兰本来就是中国的,1106866016,coco冯214,3.5,2
677,嘉兴,1,花木兰跟敌人谈恋爱，不是在约会就是在约会的路上,1106844644,麻耶熊猫,1.5,5
678,深圳,2,我觉得很不错的。,1106860809,利迪亚,5.0,2
679,太原,1," 十分欢喜木兰画风简洁养眼，用色古朴典雅，视觉效果给人美感享受。整个画面行云流水，浓浓的中国味儿。支持国产动漫，支持我们自己的国人动画！
",1106860758,Sven An,5.0,1
680,济南,,替父从军拍出了爱情故事 为木兰塑造了一个颠覆性的形象 画面也特别精致 非常好看 值得一看,1106778591,wWF328138649,5.0,3
681,乐清,1,对待历史不严谨，不真实，不可观。其它内容基本没有用。,1106861710,uea569243385,1.5,3
682,成都,2,影片展现了一个与历史不同的花木兰，有勇有谋还有儿女柔情，画面做的也不错，值得一看,1106863637,理南,5.0,1
683,合肥,2,服装道具效果都很好！男装的木兰很帅气！场面也很壮观！,1106834995,程大嵩,5.0,2
684,上海,,Emmm有点尬,1106865400,Jeffery_yi,3.5,1
685,太原,,我觉得这部电影非常好，很有教育意义。当我看这部电影时，一下就想到了中学时候学过的一篇课文，“唧唧复唧唧，木兰当户织”，并且这部电影很有中国传统元素。,1106862763,Fna209550502,5.0,3
686,徐州,,花木兰电影拍的不错，画面很美，如果是3D估计画面感更好，必须支持国漫，值得一看。,1106861590,紫珊瑚公主,4.5,3
687,太原,,花木兰是中国古代著名的巾帼女英雄，替父从军，吃苦耐劳，勇敢无畏，是当代女性的学习榜样，花木兰事迹被多种文艺作品所表现，也成为了许多观众心中的经典形象。这部精心打造5年之久的《木兰：横空出世》让观众拥有“中国人自己的木兰”而感到无比的自豪，影片完全由中国团队制作，讲述中国木兰“忠孝节义”精神的属性，再次向中国观众诠释真正的中国木兰与真正的家国情怀。,1106857541,jsF469713838,5.0,3
688,营口,,特别好看 孩子很喜欢 故事情节也很好 不拖拉。推荐大家观看   我家孩子说 还想再看一遍呢 真的是太喜欢了 好评 10分,1106842724,牟小草,5.0,2
689,济南,1,电影很好看  人物刻画细腻 木兰和草原王子甜甜的爱情故事，最后结尾很喜欢，希望大家可以去支持一下,1106865262,南海,5.0,5
690,抚顺,,电影超级好玩，超级喜欢，演的不错，推荐大家去看，超级棒,1106862669,vMN520157889,5.0,4
691,天津,,很好看。女儿非常喜欢。,1106860514,GEw960115175,5.0,2
692,重庆,,“谁说女子不如男”，电影很好的诠释了这个主题。还可以。,1106862613,whF878187197,5.0,2
693,重庆,,挺好看的，陪孩子去看的，孩子喜欢看动漫，这部电影题材也比较正。,1106863388,ZKh488161607,5.0,2
694,济南,1,塑造了一个木兰女英雄的形象，动画打造方面也是不输别人！非常好看，虽然马上就要下架了。但是幸亏及时的买票了！,1106862491,StephenQK,5.0,4
695,重庆,,电影本身质量就不错，加上都场面专业的渲染，使得电影有着很不错的观影体验，值得去看,1106836772,，，,5.0,1
696,广州,,这动画制作我无话可说，三分钟开始玩手机,1106863236,TPQ625713443,0.5,3
697,重庆,,"迪士尼的《花木兰》并未让“忠勇真”感染到所有人，从功夫到魔幻，尽管影片堆砌了诸多元素，但依然没有讲好这个中国故事，而《木兰：横空出世》却带来了另一个故事以及不一样的“花木兰”。
真的是太好看了，简直是看过最好看的一个电影，没有比她再好看的了",1106861309,高高高gaohigh,5.0,2
698,广州,,挺好看的 可以带着小朋友去看一看 观影过程比较开心 动画效果也还不错,1106657822,一个很饿的人._,5.0,3
699,哈尔滨,,N，壤郧蒎蛰阴间侗熙,1106862381,acI758159985,0.5,4
700,长春,,强烈推荐 好看,1106860316,李兆颜颜颜颜颜,5.0,2
701,郑州,2,"中国人终于用自己的视角和理解拍出了属于我们自己的“花木兰”故事
三维动画得花木兰也让我们见识到了国漫的崛起
是一个很适合12岁以下儿童去看的电影",1106786872,xmL240892620,5.0,3
702,重庆,,超燃超飒的。小时候就很喜欢看木兰，圆梦了,1106861218,ule261635367,5.0,1
703,大连,,一部很好看的片子 特殊时期到矛盾到了花木兰身上 为了爱情两军停战 加油花木兰 中国动漫加油 值得一看 ,1106653184,ZDa598093104,5.0,2
704,南京,,支持国漫 画面很细腻 将花木兰刻画的很好 值得一看,1106691258,饿了么小王子61,5.0,2
705,钦州,1,动画效果很好，很适合带小朋友一起看！花木兰替父从军的故事很让人感动。,1106853968,唐唐唐唐唐唐先生,5.0,3
706,信宜,,这讲的什么玩意,1106853949,momo,0.5,1
707,晋中,,木兰这个电影虽然有点垫付传统，但是绝对是一部很不错的电影，真的很好看。推荐。,1106857638,我想你啦,5.0,4
708,太原,,电影贼好看，动画贼生动，声效贼立体，这是我看过迄今为止感受最深的一部国产动漫。爱辽爱辽，想看的集美们赶紧动起来喽！！！,1106852603,gwX416290912,5.0,1
709,晋中,,颠覆传统的木兰，颠覆传统的精彩，真的很棒的一个片子，强烈推荐大家去看。,1106842497,tDV322767710,5.0,4
710,晋中,1,这部木兰很有中国的传统元素，无论背景，音效，还是人物故事。令我想起很多童年动画片,1106842490,局外人,5.0,2
711,晋中,1,木兰这个电影很是生动，颠覆了传统的认识，勇于创新，挺好的。支持。,1106842486,牵涉,5.0,5
712,成都,1,电影本身质量就不错，加上都场面专业的渲染，使得电影有着很不错的观影体验，值得去看,1106852861,该,5.0,5
713,晋中,1,被花木兰圈粉了，从小就熟读木兰诗，特别喜欢花木兰这个角色，看完电影后，心里越发崇拜木兰，希望导演再拍续集,1106851894,刘冉,5.0,2
714,合肥,2,很好看，推荐大家去看，故事情节不拖沓，大家都去看起来，支持支持。,1106854873,-ONLY-,5.0,2
715,晋中,,画风不错，人物刻画仔细。不同于以往的花木兰，迪士尼的虽然很华丽，但感觉西方的思维太多了。,1106853744,eFR204738574,5.0,3
716,成都,,国漫的发展我们有目共睹，木兰横空出世的首映我先睹为快了，早早地去看了这个电影，总的来说很不多，适合国庆档大团圆带上孩子去看，小朋友可喜欢了。,1106611474,小洲,5.0,4
717,北京,2,算是故事新编，看个新意吧，不考虑故事设定，还是有笑点的，厅里的小朋友都看乐了。动作场景非常多，还可以去！,1106851858,情有独钟,5.0,1
718,驻马店,1,影院效果很棒，剧情也很充实，绝必是值得去电影院看的好片,1106749364,昊霸霸221,5.0,2
719,封丘,,被花木兰圈粉了，从小就熟读木兰诗，特别喜欢花木兰这个角色，看完电影后，心里越发崇拜木兰，希望导演再拍续集。,1106852798,vJF向着光自由,5.0,3
720,营口,,跟小时侯看的花木兰是完全不同的，是完全符合咱们中国的动画片。近几年咱们国内的动画崛起，出了很多的精彩佳作。希望以后可以看到更多的好看的国内动画电影。,1106852784,废Q先生,5.0,3
721,天津,,算是故事新编，看个新意吧，不考虑故事设定，还是有笑点的，厅里的小朋友都看乐了。动作场景非常多，还可以去！,1106857403,Yrf992737890,5.0,2
722,盐城,1,画质音质都太烂了，声音听着刺耳，画面太胡，字都看不清的，模模糊糊的。,1106828351,严歆然,0.5,2
723,信阳,2,"没看过的人，有什么资格评价
让中国女孩的故事，宣扬于世界，人尽皆知！9899 ",1106851818,xzI139566368,5.0,2
724,成都,2,"在浩瀚无穷的历史长河中，花木兰的故事曾经反复被讲述、传颂，也曾在时间的流逝中不断被丰富，绽放出耀眼的迷人光彩。
从最初郭茂倩编撰的《乐府诗集》中的《木兰辞》到徐渭的《雌木兰替父从军》，再到清代张绍贤的《北魏奇史闺孝烈传》，花木兰的故事多了不少厚重的历史底色，也从简单的替父从军发展成为女性波澜壮阔的个人史诗。",1106778471,Cynthia6595,5.0,3
725,绥化,2,导演以自身的传统美学功底，对电影的写实艺术特性也有精深的理解和把握，他特别擅长以生动的细节描绘人物的内心活动，并调动电影的各种艺术元素为塑造人物服务。,1106851797,Mcp216684382,5.0,2
726,成都,1,总的来说，这个片子要是不带小朋友去看，就亏大了，音乐很棒，画面感很舒适,1106646095,OOx428490346,5.0,3
727,太原,,万里赴戎机 关山度若飞 演员演技在线 打戏堪称完美,1106852543,给阿东来点醋,5.0,2
728,杭州,,就这？我直接看到一半离场,1106857280,游泳圈第一名,1.0,2
729,肇庆,,这部片子还行吧。。。,1106853425,gjQ856969969,3.0,3
730,深圳,,很迷，剧情看不懂,1106854492,pYs956060882,0.5,2
731,成都,,电影很好看，没有让我失望的哦，演员们颜值演技都在线。,1106850959,Kcp784729871,5.0,2
732,青岛,,很好看，挺入人心的，看着花木兰的一路成长，也希望身边的孩子能感受到木兰替父从军，保家卫国的英雄精神。,1106854252,知心6660,5.0,1
733,重庆,,快点和你的家人去看吧！国庆期间很值得一看！ 主题曲也很好听！快去快去！认真看完,1106847282,Pao888813726,5.0,1
734,北京,,电影非常好看,1106853211,gyX652484434,5.0,5
735,青岛,,相比美国人拍的花木兰，国漫有自己独特的风格，也更适合国人的口味。这个木兰真的很漂亮，比其他的都好看。,1106844061,YlO440115776,5.0,1
736,重庆,,这个电影真的是绝了，里面的情景让我欲罢不能。无论是配音还是动作，都是很完美的。我非常喜欢看这部电影。,1106854205,qgb526030457,5.0,2
737,重庆,1,国产动漫，支持一下，朴素的爱情故事。,1106836340,kaT992683608,5.0,2
738,聊城,,画风不错，人物刻画仔细，很有中国的传统元素，无论背景，音效，还是人物故事都很不错,1106846990,恩呢米,5.0,1
739,广州,,五年打磨出来的电影，剧情非常好，从儿女情长到家国情怀！真不错,1106821484,XMV898983016,5.0,1
740,青岛,1,此番主创团队对于木兰经典题材及新颖“刺客”人设的精心融合，更是为影片提供了“老少通吃”的天然属性。,1106834347,神探狄仁伟,5.0,1
741,成都,,剧情还是比较简单易懂的，适合带家里小孩去看，明天去二刷吧，我看别人家的小孩都喜欢得不得了,1106852005,小志,5.0,4
742,成都,,期待已久的电影，总体来说让人满意，趁着国庆假期去看了个首映，不愧是中国人自己的木兰，果然厉害919191,1106634652,已注销1784457,5.0,4
743,成都,1,替不一样的木兰，不一样的故事，但还是那种熟悉的味道木兰的成长我们都能看见。特地带孩子来看的，希望他能学到点什么,1106607988,yBa254207535,5.0,4
744,青岛,,木兰“飒”气来袭，闪亮登场就发育满级，独自一人“清兵线”，还要潜入敌营“偷水晶”？一句“我，花木兰在此”够飒爽~,1106848874,Isa636449599,5.0,1
745,无锡,,买了票。因事没去看。看了预告片就给个7分吧。,1106836247,王老五的大钻石,3.5,3
746,潍坊,2,影片中融入了爱情故事，很贴近这个时代，轻松诙谐的故事一点不枯燥 也有悬疑的类型，对于反派有一定悬念性 整体画风也很漂亮，木兰的造型很喜欢，也很适合小朋友看，国漫牛！,1106824609,Riccio,5.0,1
747,宿州,,非常喜欢这部木兰  与以往的木兰都不一样  非常适合带上孩子 全家相约电影院  强烈推荐,1106848844,tJr429609698,5.0,3
748,青岛,1,国人拍摄的木兰巧妙的融合了近代新文化思潮与传统的中华文化，以故事新编的形式将浓厚家国情怀融入到本电影中。矛盾设计新颖，剧情构思巧妙，借木兰与草原王子的纠葛描绘出一场私人情感与家国大事之间的取舍问题，引人深思，是一部不可多得的爱国主义大作,1106836233,荩余欢,5.0,1
749,聊城,,电影整体感觉很好 木兰那种爱国情怀细腻的刻画了出来 看完使我非常振奋 充满了力量,1106834281,BBZ571995860,5.0,1
750,成都,1,唧唧复唧唧，木兰当户织。不闻机杼声，惟闻女叹息，这是初中时背的篇目了，一眨眼，大学都快毕业……电影还行，希望越来越多的被选入课文中的中国传统优秀故事能被拍成电影，走进大银幕,1106617411,小志,5.0,5
751,成都,,替父从军，保家卫国，木兰的成长我们都能看见。特地带孩子来看的，希望他能学到点什么,1106611135,宝贝crazy,5.0,2
752,青岛,,"迪士尼的《花木兰》并未让“忠勇真”感染到所有人，从功夫到魔幻，尽管影片堆砌了诸多元素，但依然没有讲好这个中国故事，而《木兰：横空出世》却带来了另一个故事以及不一样的“花木兰”。
真的是太好看了，简直是看过最好看的一个电影，没有比她再好看的了",1106848783,PGX545389989,5.0,1
753,成都,,众口难调，虽然我很喜欢这部电影，但不禁还是有些疑问，中国的电影，中国的动漫，究竟应该朝着什么方向发展，是专注中国特色，坚持中国风？还是迎合海内外市场，走出去？近些年应该能看到一个方向。一个转变吧，木兰加油,1106634409,gCh748919644,5.0,4
754,青岛,2,三维动画模式讲述花木兰，让人觉得国产动漫，值得期待。今年看的第一步电影，推荐。,1106850313,一罐洁酱,5.0,1
755,菏泽,,太好了吧，非常好的一部电影，值得大家一看，超酷的视觉盛宴,1106849703,wKc777489611,5.0,1
756,长沙,,国漫是要崛起，但国漫不能被宠坏，它更需要鞭策与成长。,1106847755,灵芝弟弟,5.0,3
757,齐齐哈尔,,不好看！没啥意思！,1106836172,WKn642817074,1.5,2
758,青岛,2,从功夫到魔幻 参杂了好多因素 第一次看国漫 很好看！雄起！！,1106825842,今天少吃点,5.0,2
759,重庆,1,非常好看，超炫的视觉效果，值的值得大家一看，棒棒哒！！！,1106807721,一路狂奔,5.0,1
760,青岛,,谁云女子不如男 万里从军一力担 古诗词里云 木兰侠女之心 超越性别超脱自我 她不但勇猛 还非常有智谋 替父从军尽显孝道 还战功沙场 为国尽忠为人民造福,1106848586,XRV955632042,5.0,1
761,开封,,好看啊我是你自己用,1106847611,Why0905,4.5,1
762,泸州,,不好看，睡着了,1106846619,today81388,1.5,2
763,潮州,,"烂片蹭国漫和国庆节的热度
",1106846594,GAj656971617,0.5,2
764,合肥,2,很喜欢花木兰这个故事，这是一个散发着女性光辉形象的经典故事。制作算精良，配音演员选的非常好,1106849307,白雪,5.0,1
765,天津,,作为中国为数不多的几部动画电影之一，也买了票以后心情也是非常激动，看完电影之后感觉也是很不错的，动画效果逼真，动画人物性格塑造真实深入人心！非常值得一看。,1106847438,abayyy_,5.0,1
766,青岛,1,木兰 横空出世用中国人讲好了中国传统故事，画面制作精良，内容完整叙述了中国传统故事木兰的故事，是国庆节不能错过的一部国漫。！,1106846421,pluto,5.0,2
767,成都,,画面很大气，整场电影感觉非常流畅，有激动人心的地方，也有感人的地方,1106845699,NJt268634808,5.0,1
768,长春,,很唯美的一部电影  这部电影(木兰:横空出世)很有中国的传统元素  无论背景  音效  还是人物故事  国产动漫  值得期待  中国人的故事  中国人讲,1106617305,生煎得有汤儿,5.0,2
769,惠州,2,不好看，差劲,1106846302,JMs268099888,2.0,3
770,青岛,,电影剧情紧凑，情节跌宕起伏，真心希望国漫崛起，好看，支持国漫！,1106849052,诗酒趁年华_0,5.0,4
771,广州,2,好看，棒极了。,1106845695,Karena91,5.0,3
772,青岛,1,"这部电影是我最近看的最后看的  全程剧情紧凑
信任深入 给我留下震撼",1106848161,Wj,5.0,1
773,青岛,,这部电影非常好看  内容十分精彩 非常适合观看 有机会可以来看,1106847206,qgl463871436,5.0,3
774,青岛,,00木兰:横空出世》   看了才是知道很好看，国漫真的强，希望越来越好，一直好下去，当然木兰也很棒，加油，会一直支持下去的，冲冲冲,1106845615,Cmt746488329,5.0,1
775,青岛,,强烈推荐这部电影，完全把木兰的正义和热血展现的淋漓尽致，非常值得观看,1106846225,TmH725653360,5.0,1
776,沈阳,,超级好看……,1106845603,琪琪victor,5.0,3
777,沈阳,1,被花木兰圈粉了，从小就熟读木兰诗，特别喜欢花木兰这个角色，看完电影后，心里越发崇拜木兰，希望导演再拍续集,1106848084,瀚墨,5.0,2
778,青岛,2,很喜欢这个电影，觉得和自己喜欢的人在一起看很有意义。国产电影越来越好了！！！,1106845565,Chichian  Huang,5.0,1
779,大连,1,特别好看，崛起，有机会会带妹妹二刷，强力推荐,1106821813,尼999999,5.0,4
780,聊城,1,非常有教育意义的影片，展现了木兰精神！支持国漫！强烈建议大家去看！超级棒！,1106614926,鲁能泰山,5.0,4
781,青岛,,很喜欢这个电影，觉得和自己喜欢的人在一起看很有意义。国产电影越来越好了！！！,1106845549,GKU712397139,5.0,1
782,青岛,,剧情新颖，人物特效很好,1106846167,tGL602014077,5.0,1
783,青岛,2,很好看，特效完美，值得观影!,1106847112,哈倩倩吖,5.0,1
784,慈溪,,真的挺好看的,1106843875,奶果酱neko,5.0,1
785,赣榆,,混淆历史，模糊主线。,1106834003,FIu111213079,0.5,2
786,长治,,看着花木兰的一路成长，也希望身边的孩子能感受到木兰替父从军，保家卫国的精神。,1106847069,wdn107567060,5.0,2
787,青岛,,电影全程无尿点，木兰主题素材电影，画面层次感强，色彩丰富，主题故事跌宕起伏。,1106846051,qFv310950442,5.0,2
788,郑州,,花木兰的故事 从小看到大 每次都会看到新剧情 替父从军 巾帼女英雄的征战沙场 打破常规 大门不出 二门不迈的时代女性 动漫把花木兰表现的更加出色 张碧晨唱的歌也好听 国漫崛起～,1106688179,源儿的,5.0,2
789,重庆,,动漫画面很棒，李斯丹妮唱的主题曲哟，从另一个角度讲述了木兰的故事！,1106821745,fYp659208729,5.0,1
790,茂名,,不要看，不要看，不要看，很难看，很难看，很难看，重要的事情说三遍,1106845383,lzwmeng,0.5,4
791,沧州,2,比期待高出很多的一部电影，蛮好看的！期待更好的表现,1106841891,As you wish,5.0,2
792,青岛,,"迪士尼的《花木兰》并未让“忠勇真”感染到所有人，从功夫到魔幻，尽管影片堆砌了诸多元素，但依然没有讲好这个中国故事，而《木兰：横空出世》却带来了另一个故事以及不一样的“花木兰”。
      真的是太好看了，简直是看过最好看的一个电影，没有比她再好看的了",1106839897,薛喵的纸盒,5.0,1
793,青岛,1,"迪士尼的《花木兰》并未让“忠勇真”感染到所有人，从功夫到魔幻，尽管影片堆砌了诸多元素，但依然没有讲好这个中国故事，而《木兰：横空出世》却带来了另一个故事以及不一样的“花木兰”。
真的是太好看了，简直是看过最好看的一个电影，没有比她再好看的了",1106814929,薛喵の纸盒,5.0,1
794,吉安,2,《木兰：横空出世》的画风融合了中国传统文化元素，很对口很中国风，很喜欢！,1106814924,梦琪,5.0,2
795,青岛,,00木兰:横空出世》   世界上第一个运用三维动画来讲述经典故事，我们讲的是属于中国人的木兰故事，中国观众的文化背景，更容易引起共鸣。给予全新的木兰，反映21世纪新时代女性肩负的重任，依然逆流而上，实现自己的人生价值。好看值得去看!,1106814928,Shouldn't,5.0,2
796,郴州,,感受家国情怀，感受那无人不知无人不晓的木兰传奇，中国人的故事，中国人讲，支持国漫！,1106843438,Ecm606461371,5.0,3
797,松原,1,好看是好看，买错场次不能退换不合理,1106839674,qkC303572858,5.0,2
798,苏州,1,支持国漫，看完后热血沸腾的，木兰替父从军的精神永远刻在我的心里～,1106838929,李航,5.0,3
799,邢台,,"后悔今晚一耽搁没去看，明天没得看了，再看不知道到什么时候了，元旦会不会上映？//很喜欢国漫，一般都会去看的，有能力还是要支持一下。尤其是最具中国画风的古风动漫，觉得构图大多都很有意境，还很唯美。淡雅复古的配色个人觉得最甚，比如唱诗班出的一系列《相思》、《元日》等，无论是画面，剧情，还是表达的感情都给人很舒服的感觉。
",1106839540,IIZ845014269,5.0,2
800,镇江,,被碰瓷营销毁掉的子供向动画电影，花木兰这三个字都是后期重配音的，换成一个架空世界，改个名字完全是一部合格的子贡动画。,1106707167,高级愤檠,2.0,2
801,广州,,花木兰本身，也从一个秉承孝道、英勇杀敌但面目模糊的女英雄，发展成为情感丰富、有血有肉，集机智谋略和平权意识于一体的，具有女性先锋意识的综合形象。是真不错91,1106839371,PCq282352211,5.0,1
802,南宁,,"画面好美哦
看得我都想到电影里面的那些画面去旅游了
这部电影的风景画得好好看，
真的是风景美如画。
拍电影的叔叔阿姨哥哥姐姐真的画画画得很好
把这么美的风景画出来。
还让我们看到了一个不一样的花木兰的故事。
",1106838625,施夷光,5.0,1
803,青岛,,国漫步步崛起，电影还不错，情节也还行，值得一看。,1106838617,同饮长风,5.0,4
804,南宁,1,"哇，这部动画片的主题曲好好听！李斯丹妮唱得好好听
还有片尾的那首谁谁谁唱的片尾曲也好听
难怪说主题曲是本片的卖点，真的耶
为了听完片尾曲我看到字幕的最后一个镜头才走，影厅就剩我和静静陪我听歌的检票员。
",1106821464,鲍里斯・瓦西里耶夫,5.0,2
805,汕尾,1,可以可以，电影不错,1106835939,久违-0330.,5.0,2
806,肇庆,,还好吧，就是这动画做的别扭，剧情完全是瞎编的，叫花木兰只不过蹭一下著名人物。剧情尴尬,1106837305,pkoctover,3.5,2
807,北京,,"给大家讲个段子。
今天带儿子看电影，在《信条》和《花木兰》中间犹豫了半天，最终选择了《花木兰》。
电影一开场，傻了，这是啥？动画片？闹了半天我才明白，这不是《花木兰》，这是《木兰：横空出世》！（感觉去看盗墓笔记的我看了个扫墓笔记……）
又看了一会儿，我儿子受不了了问我，妈妈，这帮人是怎么建模的？为什么这么丑？他们打的蝎子不是泥盆纪才有的史前巨蝎吗？这个地貌不是明显秘鲁一带吗？…………
最后，这故事编的吧！不知道怎么能进院线，我看到最后都不禁产生了一丝佩服，这样都能写完，这心理素质，也是没谁了……",1106837276,gHg186958271,0.5,4
808,合肥,1,带孩子去看的，孩子非常喜欢，希望多出这样的电影,1106838430,人力资源长年招工18175006192,5.0,2
809,吉安,,整个影片耐人寻味，有深刻的启迪意义的。国货之光啊。希望以后多点这样的电影。,1106839166,AUr962769169,5.0,3
810,长春,1,故事情节简单明了，挺适合小一点的孩子去看。片尾曲好听。国漫加油！,1106838373,LhT733225225,3.5,3
811,重庆,1,蹭热度吧，动画做得垃圾，剧情垃圾,1106839105,BigFaceCat,1.0,2
812,合肥,,适合家长带孩子去看，非常好看的电影，比真人好看多了,1106839067,kXw487841990,5.0,2
813,郑州,,买11:50的场次，全场三个人，一起吐槽剧情到解释，懂的都懂，还有那个美工，整局就俩女的，还长一个样，一个剧12个建模师，均下来人物感觉还分不到一人一个，真滴牛B，而且到最后也没说军师哪国人，这中文怪好，一点儿口音没有,1106778164,.,0.5,2
