,城市名称,用户性别,评论,用户id,用户昵称,用户评分,用户等级
533,淮安,,好看好看，太精彩了,1106931489,90 小丸子,5.0,1
534,鄂尔多斯,2,有一点无聊。,1106917390,。,4.0,1
535,鞍山,,真不咋地！！,1106933141,高キキン,0.5,3
536,成都,,中国制作感觉还不错，适合带孩子看一下，支持国漫,1106930533,醉红尘1981,4.5,4
537,西安,,完美我最喜欢小马管,1106930256,Iae939800186,5.0,3
538,长春,2,情节稍简单，小朋友喜欢看,1106887704,爱乐乐日记,5.0,2
539,武汉,,感觉一般，建模也粗糙了，剧情上也没啥尿点,1106927493,MeD369863558,3.0,2
540,鹤壁,,完美的动画片,1106917046,Zut563506514,5.0,2
541,福州,,这部电影很棒 尤其是在特效方面绝对是大作 能碾压大部分的国漫 结局也能完美 整个剧情设计严谨 还是比较不错,1106927341,iGd287386102,5.0,2
542,合肥,2,动画幽默风趣  动作非常流畅  情节跌宕起伏  情感真挚  结局也是很美好,1106782620,宋薇,5.0,2
543,青岛,,非常烂，有损木兰民族英雄形象,1106926349,gwG404038839,0.5,2
544,东莞,,烂不烂，看看撤不撤档！,1106900940,wlzb003,0.5,2
545,义乌,,看到一半睡着了,1106925047,糖爸321,0.5,2
546,南川,,霸道草原王子爱上木兰，MD**的白月光就被这样魔改，还不如刘亦菲的呢，至少可以欣赏神仙姐姐的颜值,1106923632,牵露井,0.5,2
547,桂林,,花木兰啊，除了帅，就一无是处啊哈哈哈哈哈，剧情和细节没怎么感觉，动作方面很OK，,1106900818,沐辰,3.5,2
548,江门,,画风好迷剧情很烂导演蹭热度,1106895929,Ccf150994736,0.5,2
549,成都,2,非常好看，有些地方也很搞笑，结尾还有李斯丹妮唱的歌，超级好听。旁边小孩也非常喜欢这部电影，很欢喜。影片人物刻画得不错，很有中国元素，值得一看。,1106922635,江凌,5.0,2
550,东营,2,好看，激起我的爱国热情，教会孩子们正义勇敢，面对困难不服输的精神！,1106916799,我心永恒,5.0,2
551,大连,,好看好看可以带孩子去看看,1106916076,fageid,5.0,2
552,三台县,2,适合小盆友去看,1106913566,SJksndjdks,3.5,1
553,洛阳,2,整体配音超级棒，非常飒燃起一腔热血，支持国产，希望国产动画动漫都能越做越好，人物刻画的非常饱满，从一个刺客开局，写出了不同的故事，友情爱情，诙谐轻松，到抗击坏人，结束战争，什么是恶人，又什么是正义那，反转的反转，通人性的踏雪，整体故事让人热血沸腾，非常好的一部电影，不枉此行,1106909825,甜甜的小雯雯,5.0,2
554,薛城,1,花木兰替父从军是我国人尽皆知的神话故事，今天必须来支持，中国动漫的制作水平越来越高了，相信不久的将来一定会赶超日漫。支持国产动漫，支持传统文化！,1106663520,Zgs409887897,5.0,3
555,张家口,2,一般般吧，国产还需要进步,1106909459,哎呦喂,0.5,2
556,银川,1,支持中国国漫，比起一群外国人演的花木兰。我更愿意看这个,1106903830,。,5.0,1
557,南昌,,木兰的这部动漫看起来有哪吒那种感觉 很精彩  画面 特效 打斗场景都做的很棒 值得一看   希望以后能有更多好看的国漫 很喜欢,1106907735,ZXG4560,4.5,2
558,重庆,2,应该说还是挺不错的，剧情比较流畅，打斗场景设计好，片尾曲很好听。,1106903639,wishfeng,5.0,4
559,天津,2,格局太小了，但音乐和动画不错，木兰恋爱的故事,1106904919,海鹰948,2.0,2
560,蚌埠,,"迪士尼的《花木兰》并未让“忠勇真”感染到所有人，从功夫到魔幻，尽管影片堆砌了诸多元素，但依然没有讲好这个中国故事，而《木兰：横空出世》却带来了另一个故事以及不一样的“花木兰”。
真的是太好看了，简直是看过最好看的一个电影，没有比她再好看的了",1106904886,雨辰文化传媒-小张,5.0,2
561,开平,,跟迪士尼那个根本是两个等级，迪士尼直接把故事都改了 ,1106903546,circle_tan,5.0,3
562,石家庄,,一直很期待这部电影，和朋友一起去看了，剧情很好，节奏也把控的很好，果然没有失望，非常好看！,1106891338,张腻腻最美腻！,5.0,1
563,南昌,1,刚看过真人版的花木兰刘亦菲演的，就来看这个动画版的花木兰，真的很好看，比真人版的花木兰好看多了。我以前看过美国拍的迪尼斯花木兰，丝毫不亚于那个好嘛。又热血又搞笑，国庆看得最满意的电影了。,1106903335,末伏,5.0,3
564,淮南,,还可以吧，可以去看,1106907081,S蜜柚子,4.0,2
565,银川,,怎么，连动画片都要整起偶像剧了吗？晕,1106905223,wyl0928,0.5,2
566,深圳,2,适合孩子看，无法给小朋友讲解清楚的故事，可以让小朋友通过大屏幕用她们自己的视线去观看，去理解。,1106902186,咪咔,5.0,2
567,大连,,"迪士尼真人电影《花木兰》

口碑备受争议之后，

这一部国产原创、以三维动画形式呈现的作品，

能够讲好我们自己的木兰故事",1106904191,ILI703509247,5.0,3
568,淮安,1,好看，不丑，推荐，吊打刘亦菲美国人,1106905037,lancer李,4.0,3
569,仁怀,,"我从来没有给过烂评，到这个是真的烂。借鉴的痕迹太明显，东拼西凑的。没有创新，没有重点，衔接太牵强，人物塑造不讨喜。
建模不符合场景，而且好多我几乎都能在我看过的电影里找到几乎一样的场景，不仅没有加分，反而让人觉得很奇怪。实在是不讨喜。连台词也有太多借鉴，可能作者潜意识里将看过的电影都用上了。
但作者看过，观众又何尝没看过。
全程都是想都不用想就知道接下来会发生什么，这样的电影实在没有看头。或许是符合小孩子的口味的，但我不一样以后我的孩子看这样太多废话，太没逻辑的剧。",1106897873,F.I.N,0.5,3
570,大石桥,,挺好的。。。,1106858830,沈梦听雨,5.0,1
571,佛山,,"撤什Nn! 看了, 很不e的影. m然∏橐话, 美工棒棒的, 值回票r了. 比那迪士尼什N''的, 好太多了. 
",1106840177,qgC120761122,4.0,1
572,南昌,1,动画版花木兰，有趣有意思，木兰和王子的爱情，挺适合一家人一起的,1106898714,逐梦那世界,4.5,4
573,上海,,整体画面不错,1106858776,opZ923959166,4.0,2
574,杭州,1,塑造了一个木兰女英雄的形象，动画也还不错，挺值得推荐的！国庆期间确实可以看看,1106899775,Sins568,5.0,4
575,抚顺,,电影很好看，小朋友很喜欢，画风精美，里面掺杂着大量中国元素，中国的传统传奇故事被拍成了电影，值得一看,1106901378,小萍,5.0,1
576,武汉,2,好看   也很搞笑  不知道为啥看的人不多,1106897575,小y超幸运.,5.0,4
577,大庆,,"演员阵容和演技真的不错了
但是迪士尼的制作和拍摄…
真的是不敢恭维…
前几分钟镜头居然有抖动
后面的妆容和风格也真是让人无法理解…
白瞎了这么个传世经典的故事
",1106872948,96葛同学,4.0,2
578,合肥,,"小到飒沓似流星的木兰女装，大到留白风格的国画山水与家国情怀，#国漫电影木兰横空出世#以十足诚意讲好了一个热血与温情并存的中国故事。“万里赴戎机，关山度若飞。”无人不知无人不晓的木兰传奇，通过国漫方式演绎出来同样别有一番趣味,很适合带孩子一起看。这个国庆，且看木兰征战沙场!",1106896564,AYF748859004,5.0,2
579,青岛,1,垃圾电影，花钱让我们来看电影给好评，看完之后不给报销。千万别看这种垃圾电影,1106748034,？,0.5,2
580,嘉善,1,非常好看，喜欢的可以一起,1106876751,305478浅笑安然,5.0,2
581,合肥,2,"小到飒沓似流星的木兰女装，大到留白风格的国画山水与家国情怀，#国漫电影木兰横空出世#以十足诚意讲好了一个热血与温情并存的中国故事。“万里赴戎机，关山度若飞。”无人不知无人不晓的木兰传奇，通过国漫方式演绎出来同样别有一番趣味,很适合带孩子一起看。这个国庆，且看木兰征战沙场!",1106898358,洪慧唯婷,5.0,2
582,抚顺,,电影很好看。小朋友看的很开心 故事也是重新编写 画风优美 制作精良 角色塑造的太美了 唧唧复唧唧～,1106896509,唯一wwww,5.0,3
583,武汉,,木兰 横空出世  电影里面有大量中国元素 中国传统文化传奇故事拍成电影 致敬～ 画风很好看,1106899377,我是唯一阿.,5.0,4
584,泉州,1,与我们中学生学的历史严重不符，烂俗桥段太多，过于夸张。,1106880425,泉州,0.5,1
585,抚顺,,真木兰 真国漫  木兰替父从军的传奇故事 重新编写 里面大量普及中国元素 画风优美 电影很好看,1106899319,唯一,5.0,3
586,宁德,,很适合小朋友看,1106872857,。。。。12769,3.0,2
587,合肥,,"转自导演微博：大家好,我是国漫电影《木兰：横空出世》的导演，廖光华。2015年始，我们就立志以动画形式还原中国木兰的精气神。作为一个从小就在学习《木兰辞》、木兰文化、木兰精神的中国人，我也是在对木兰这个巾帼英雄的喜爱和崇敬里成长起来的。西方人对木兰的无端臆想，是我完全不能接受的，相信也是有家国情怀的中国人不能接受的！
那些大放厥词说我们蹭热度的，请问谁愿意拿几年心血制作的影片去蹭一部口碑崩盘的片子？看完迪士尼木兰，我们比以前更自信，中国的木兰真的是要中国人来拍，这次两个花木兰虽说相隔不到一个月上映，但我们讲的故事算是赢定了！
#木兰始终是中国人的木兰# 请大家期待国漫电影《木兰：横空出世》。",1106899096,石JW,5.0,1
588,徐州,1,带孩子去看的，全程很感动，见证了国产动漫的巅峰出了影院心情久久不能平复，无论配音还是画风以及分镜都很,1106896205,GdO422890157,5.0,2
589,合肥,,"转自导演微博：大家好,我是国漫电影《木兰：横空出世》的导演，廖光华。2015年始，我们就立志以动画形式还原中国木兰的精气神。作为一个从小就在学习《木兰辞》、木兰文化、木兰精神的中国人，我也是在对木兰这个巾帼英雄的喜爱和崇敬里成长起来的。西方人对木兰的无端臆想，是我完全不能接受的，相信也是有家国情怀的中国人不能接受的！
那些大放厥词说我们蹭热度的，请问谁愿意拿几年心血制作的影片去蹭一部口碑崩盘的片子？看完迪士尼木兰，我们比以前更自信，中国的木兰真的是要中国人来拍，这次两个花木兰虽说相隔不到一个月上映，但我们讲的故事算是赢定了！
#木兰始终是中国人的木兰# 请大家期待国漫电影《木兰：横空出世》。",1106898038,bhk450410480,5.0,2
590,株洲,1,画质特别清楚。一个不一样的花木兰的故事，没有之前从军的剧情，直接单刀直入。反派独孤真的超级帅，哈哈哈！难得动画片把人物形象做得那么漂亮,1106892975,GerardButler,5.0,4
591,上海,2,画风很好，内容很烂，放在几年前还可以看吧，看的时候都能猜到后面的内容。。。。。。,1106892709,despair.,1.5,2
592,沈阳,,十一小长假 电影安排起来 花木兰作为国产动画 影片效果还是不错的 动画画面灵动连贯 情节紧凑 武打动作行云流水 还是值得一看的,1106893279,任,5.0,2
593,青岛,1,电影十分经典 刻画人物形象突出人物特点 丰富展现了我国传统文化 好看,1106893257,梦,5.0,1
594,沈阳,1,"虽然是动画片  但是画风很有点儿动漫游戏的样子 
很精致  细节特别到位  
飘舞的长裙和长发
 摇曳的红枫 
猎猎的战旗 
奔腾的战马 
国漫的后起之秀呀
好喜欢",1106888669,文韬4002,5.0,4
595,菏泽,,这简直是传说级烂片，还没有真人版的好看，至少那个真人版在豆瓣还有5分，这玩意直接3.4,1106716151,Oleiki桑,0.5,2
596,青岛,,国漫经典之作。总体效果很棒。值得推荐 大家可以去看看,1106892452,挚友梦宇,5.0,2
597,阎良,,很好看，看完之后很震撼，看我我都想参军了。里面花木兰那个角色简直了，爱了爱了。,1106890478,ncU512033773,5.0,2
598,百色,2,值得一看，比之前那个花木兰好多了，画面很美。,1106872492,林焕敏104,5.0,3
599,福清,2,本来想看另一部花木兰的，进了影厅才发现买错票了，但是买都买了就看看呗，结果这是什么宇宙无敌超级大烂片啊？剧情俗套到时间倒退二十年也会被人臭骂到程度，画面还不如喜羊羊好看，边看边在心里暗骂，把它称为电影都是在夸它，买水军刷好评也改变不了这是部烂片的事实,1106739744,90,0.5,3
600,忻州,,9797979797,1106892240,Vhk332524360,5.0,1
601,大连,2,小到飒沓似流星的木兰女装，大到留白风格的国画山水与家国情怀，以十足诚意讲了一个热血与温情并存的中国故事。“万里赴戎机，关山度若飞。”无人不知无人不晓的木兰传奇，通过国漫方式演绎出来同样别有一番趣味,1106892216,仙女渣渣,5.0,5
602,保定,,这个木兰只是个恋爱脑，一点也不木兰，大概只是同名吧……,1106888332,PTz692389363,0.5,2
603,张家港,,真真的不咋地,1106892077,qqqqqqqq,2.5,2
604,珠海,,烂成这样，那些打十分的是收了多少钱啊,1106892023,五月ws,0.5,4
605,,,国庆抽空来看了这部电影，电影很不错，看完感受很深，影院设施设备都还不错，也推荐大家去看这部电影，下次还会再来哒,1106849756,ynC376864467,5.0,2
606,天津,2,"剧情完整,制作有待提高,整体满意！",1106886589,_alipay863958038,4.5,3
607,常熟,1,编的什么玩意，白瞎了动画师的辛苦，,1106889174,张张张,0.5,2
608,上海,,非常好看，喜欢里面的人物。生动有趣。画质炒鸡棒。特效处理。后期都非常优秀。是一部非常不错的国漫。值得一看。,1106698967,小韦,5.0,2
609,兰州,,非常值得一看,1106888038,lyj,5.0,3
610,广州,1,好看，木兰好厉害,1106884699,阿明18102713798,5.0,2
611,哈尔滨,,太难看了，，,1106884633,grJ933429199,0.5,3
612,永康,1,唧唧复唧唧 木兰当户织 不闻机杼声 惟闻女叹息 问女何所思 问女何所意 女亦无所思，女亦无所忆 昨夜见军帖 可汗大点兵 军书十二卷 卷卷有爷名 只能背到这里了，小学老师叫背的,1106783137,极,5.0,2
613,荣成,,挺好的，好看,1106885045,wZS338126600,4.5,2
614,石家庄,,估计是洗钱的，这团队做的电影都挺离谱的,1106864657,OMX244269003,0.5,3
615,枣庄,,近几年看过最烂的国漫电影。,1106884299,薛萌萌哟丶,3.0,3
616,乌兰察布,1,孩子喜欢，不错,1106882332,林刚,5.0,1
617,遂宁,,剧情真的很迷,1106872012,杨秀丽,3.5,2
618,乐山,,影片给我们展示了另一个有情有义的花木兰，她有血有肉，既有家国情怀，也有儿女情长。这一点在体现在：右手霓裳，左手军刀。这一幕表现的淋漓尽致。,1106884020,zIE663249590,5.0,4
619,南京,1,一部颇有国漫风格的动画片，众人皆知的故事，与传统故事进行稍作改编，加入爱的主题，双节期间不多的动画电影之一。,1106881021,小树人008,5.0,4
620,蚌埠,1,超级垃圾啊？,1106883129,轻浮口哨,0.5,2
621,开平,,别买 。。烂的不想说话，从一开始杀王子我就有预感，尬的一批，草原王子也不知道为什么就和木兰好上了，这部片非常没有逻辑，半颗星都不想给，唯一可看的就是打戏。。,1106883088,@不起先生,0.5,1
622,成都,2,早晨急忙赶过去说看花木兰，我们明明想看刘亦菲的，结果是动画电影，才知道原来订错票了，就将就看，看到前面还行，花木兰画的挺棒，可后来就开始乱了，和草原王子一起掉入悬崖，还遇到了超大的毒蝎？比人都大？！之后草原王子抱着老鹰的脚，花木兰骑在老鹰脖子上飞到草原？拜托，花木兰是去刺杀的呀，又不是结婚旅行，后来草原王子不知道为什么都知道花木兰是女人了，感觉还对人家有意思了？然后他们就分开了，花木兰回去就被关进小黑屋，又遇到草原王子，他们异想天开的聊，花木兰又说要当大将军又说要当侠客行侠仗义，你到底要当什么……然后又要和亲，后来和着和着就开始起兵打仗结果是误会，误会就算了，还来两次，后来又反转，阿西,1106864457,鳐,1.0,2
623,益阳,,小朋友喜欢！,1106875782,pJp26434472,4.5,2
624,南宁,2,看了这部较为新颖的花木兰，剧情总体来说还是有可看性的，不是所谓的爆米花电影，具体动漫里面的剧情跟人们耳熟能详的花木兰故事不太一样，可以说是编剧在原花木兰故事的基础上发挥想象，二次创作，让人耳目一新。动漫里的花木兰男装英姿飒爽，女装国色天香，深得我心！被迪士尼的花木兰和姜子牙动画片，掩盖了锋芒，很多人都不知道，是一部宝藏电影。,1106873790,DCp552821010,5.0,3
625,成都,,《木兰・横空出世》就如历史木兰替父从军的故事一样，从籍籍无名的小兵“横空出世”成为一代女将。,1106864384,善良的吃货本货,5.0,4
626,江津,,还可以吧，带小朋友看的，比预想的好！,1106875641,vlg730693330,4.0,2
627,抚顺,1,一般般，很一般,1106877716,刘俊385,2.5,1
628,长治,2,怎么还有服务费呢，服务费三元是什么意思？没给我们服务什么呀？,1106875560,一缕阳光,0.5,1
629,蚌埠,,电影特别好看，很期待下一部电影，我和朋友还会继续支持的,1106879005,全,5.0,1
630,成都,2,小朋友很喜欢。画风如网游。,1106877570,霁月,5.0,3
631,蚌埠,1,这部电影10分的好看，特别好看，我好喜欢呀,1106877443,【青枫影上￡~,5.0,1
632,西安,,国漫之光冲冲冲,1106875249,TgO964202161,5.0,1
633,齐河,,还可以，国漫,1106856521,Ivl841804732,5.0,1
634,合肥,1,电影很好看，音质很好，环境优美，欢迎体验极佳，下次还来！,1106859373,南笙,5.0,2
635,合肥,2,不过当迪士尼官微放出《花木兰》的预告片，我感觉这部电影在中国多半是要糊了。花木兰的故事在中国家喻户晓，虽然正史上并无记载，但主要是讲述了花木兰参与的北魏大军征讨柔然。而改编自动画片的真人电影《花木兰》是一部魔幻片，巩俐饰演的反派女巫可以变身，海外版还出现了凤凰，色调很像花木兰的衣服，难道是花木兰的“元神出窍”，依靠凤凰之力才打败了女巫？,1106871450,发光的牙呀,5.0,2
636,广州,,这是一部国漫动画片，总体感觉还不错，影片的特效和色调看起来蛮吸引的，故事的情节紧凑，值得一看!,1106868921,Sas823341246,5.0,2
637,南宁,,动画做得不错,1106869970,新月,4.0,2
638,衡阳,1,这个国庆档影片很赞 木兰守卫祖国的精神感觉更加赞一些 家喻户晓的巾帼英雄故事 视觉效果很不错哦 画面环环相扣很震撼的跳跃战斗打斗等动作 层层剥茧 所有的线索最终导向一场人心之间的大战,1106838057,一只很帅的独角兽,5.0,4
639,扬州,,很好看，下次还得看,1106873009,蕙质兰心乖乖,5.0,4
640,钦州,1,这部完全由国人团队历时五年制作，以国画山水为底色，以武侠美学为看点的当代国漫，唯美展现北国壮丽山河的同时，也将“花木兰”这个独具东方女性魅力角色的飒爽英姿全方面展示。整部影片天量的制作工程背后，是一颗打造“精美国漫”的赤子之心，绝对适合带儿童一起观赏。,1106870872,孔敏miracle,5.0,2
641,泉州,1,烂的都撤档了,1106778719,Jun。,0.5,2
642,广州,2,本来估计我家的女娃不会喜欢打仗的剧情，可是最后她看懂了木兰和独狼的友谊，还能感受到王子的勇敢，虽然实力不如军师，但也没有退缩，教育意义无处不在，正能量满满的好电影！,1106868815,zOk366430959,5.0,2
643,广州,,为国漫成长，加油，期待！,1102286942,cGn393290961,5.0,3
644,重庆,,木兰横空出世！心系苍生！大气干练有格局！我喜欢！,1106871010,美食者漫步,5.0,3
645,青岛,1,电影特效很棒，故事情节背景都很完整，值得二刷，支持国漫。,1106814979,等,5.0,1
646,肥城,,动作非常细腻真实，画面也很有代入感，带着孩子来看的，孩子看的很专注！非常喜欢这一版的花木兰，十分新颖而且有亮点,1106867617,吃货三三c,5.0,2
647,綦江,,哇哦个人觉得超好看推荐推荐木兰完美,1106867593,ROL253369043,5.0,2
648,郑州,1,孩子问这怎么和她们学习的历史不一样,1106828763,奎,1.0,2
649,蓬莱,1,我被电影中精彩打斗画面、唯美的山河以及动听的歌曲深深打动，久久回味不愿离开。本次活动获得了观众的称赞和肯定，表示希望迅视影业继续为广大观众带来更多优质的电影作品。,1106742426,94 94不羡仙..,5.0,1
650,天津,2,没想到现在国产动画片可以拍到这么好的效果～全程剧情紧扣，动画中动作做的不错～棒棒哒～,1106744053,]有化名的胖妮,5.0,3
651,天津,2,故事变得很有创意，有笑点，有励志的地方不错～很不错～,1106750896,哏都丫头,5.0,4
652,汕头,,垃圾一分都不想给   恶心的剧情 恶心的导演,1106869502,vgi249951713,0.5,2
653,烟台,,这部精心打造5年之久的《木兰：横空出世》让观众拥有“中国人自己的木兰”而感到无比的自豪，影片完全由中国团队制作，讲述中国木兰“忠孝节义”精神的属性，再次向中国观众诠释真正的中国木兰与真正的家国情怀。,1106737916,meP382675909,5.0,1
654,芜湖,,剧情大众化，基本都能猜的出来,1106866774,mmZ101857618,3.0,2
655,深圳,,我就是觉得刘亦菲版本的好看，不拖沓，不像中国自己的版本多数都是这拉家常，废话多得要死，国内拍什么都废话一堆，一点都没有文艺气息，不过也好，大众就喜欢拉家常的表演形式,1106844898,一不小心又点多了,0.0,4
656,长春,,挺好的一部电影 老少皆宜都能看 重要的是连花木兰都恋爱了 不过更重点的是影片展示的是爱国情怀 国庆期间正好一家人去看 很不错对孩子有教育意义,1106726758,JZs796518572,5.0,1
657,晋江市,1,画面可以的，就是剧情有点狗血，还我花木兰。。。。,1106867418,大猫,2.5,3
658,哈尔滨,,情节生动形象有趣 动画效果不次于迪斯尼 搬上屏幕的动画花木兰故事感人 动人 优于传统故事 期盼下一部好的动画,1106870161,vVo413083328,5.0,2
659,乌鲁木齐,1,刘亦菲好漂亮,1106869229,9665652406282229666696,5.0,3
660,济南,,"95 整体感受
不错 

96 印象深刻的片段
花木兰 阿格王子 独狼 联手打败无耻军师


95 喜欢的台词
我们一起走天下
我负责行侠仗义
你负责喂马
好 我本来就是个养马的",1106867175,ilx480508228,5.0,3
661,沈阳,1,国漫版本的真性情木兰与异域王子的爱情故事，建模直逼TV水平，既有优良的特效，又有感人的故事，可以说是内外双修，非常好看，推荐。,1106842964,MK.小六,5.0,3
662,锡林郭勒,,好看，动画做的也不错，和之前的国产动画片进步不是一点点,1106865920,Gea578031587,5.0,3
663,成都,,朋友说这部电影很好看，我就和女朋友来看了，真的很不错，剧情很感人，是亲子方面的，演员演技也好好，推荐来看,1106866315,tinatprince,5.0,3
664,广州,,非常不错的影片，比较准确的传达了中国文化里面的精神，也比较符合现代女性。故事节奏也掌握的很好,1105364883,idH525773429,5.0,1
665,建阳,,故事情节一塌糊涂，中国人讲不好中国故事，整场下来基本都是描述花木兰和草原王子的感情戏，除了一句代父从军之外，就是感情戏了,1106865879,窗外的阳光,2.0,2
666,上海,1,在传统的文化中又蕴含新意、寓意，拥有自己独到的见解，老少皆宜观看。支持国产动漫，支持我们自己的国人动画！,1106868008,QYd545992876,5.0,3
667,上海,,中华美学处处见，这才是花木兰该有的样子，影片充斥满满的中国风。首先画面精美异常，任何一帧截取下来，都可以作为电脑桌面。很多场景在图画设计上，一定是受到了山水国画的启发，带有明显的东方意境。,1106861988,JASONBIAN,5.0,4
668,上海,,一般 随便看看,1106866216,89477e36-c94026,3.5,3
669,海口,1,说到底，花木兰不也是一位小姑凉？她不配拥有爱情吗？,1106861966,灵魂纯净如水,5.0,3
670,重庆,,从小书本上看到的木兰，只是觉得她是一个女英雄，大了以后明白，在她身处的社会中，她不只是一个女英雄那么简单，有如此的气概、勇敢、胆识与度量，以及她的坚韧，真的异常艰难的，我们总是在讨论当代女性的特性，去强调当代女性应该如何独立自强，不如去看看木兰，可能会有答案，是柔情但不失果断，美丽但不失刚毅，巾帼但不让须眉……木兰总有魅力，让你去找到女性自己想要的特性。而且国漫越来越成长的令人欣喜了，花木兰这个题材的动漫很具有教育意义，全民皆益，满足我对木兰和国漫的双重期望。,1106855112,T九味,4.5,4
