,城市名称,用户性别,评论,用户id,用户昵称,用户评分,用户等级
387,上海,,编的没边了，替父从军编成了爱情故事，哎呦我去！,1107049706,dcK499760176,1.0,5
388,南阳,2,剧情老套，不大好看,1107053204,玖然。824,2.5,2
389,上海,,国人的木兰可没有替国出嫁。国人的木兰可不是统帅。蹭热度就算了，拍的什么***玩意儿？那些打满分的水军，这个钱拿的不亏心吗？？,1107053147,EiW809159219,0.5,3
390,江津,2,电影看完了，这会儿估计知道这个电影的人还不多吧，冲着这个背影，这个造型，爱了爱了，不知道啥时候会上映。,1106587652,红红,5.0,2
391,太原,,拍的非常差。,1107050094,jossme123,0.5,4
392,亳州,1,超出我的期待!画质精致，配音也非常好，看的热血沸腾啊，勾起小时候看花木兰的回忆，完全代入剧情，影片融入了爱情故事，很贴近这个时代，是一部具有国风情怀的国漫电影!,1107011892,020202官方,5.0,1
393,东莞,2,各方面都挺好，只是我个人不喜欢中国的典故，中国人自己却不拍，被国外人拿去拍赚钱,1107043849,6168狮子6168,4.0,3
394,西安,,一直期待的电影终于上映了，观看完之后慢慢的心喜欢，美丽的画面，曲折的情节，像我们展示了爱国情怀，也展示了爱情的美好！满分！！,1107045774,MpX298207845,5.0,3
395,珠海,,每个人心中都有一种侠客精神，仗剑天涯，行侠仗义！,1107034099,lLL107553413,4.5,2
396,荆州,,歪果的花木兰电影，不行！冲果的花木兰电影，行！我们冲果真是太棒啦，我爱冲果！,1107021797,ztU713592942,0.5,2
397,亳州,1,超出我的期待!画质精致，配音也非常好，看的热血沸腾啊，勾起小时候看花木兰的回忆，完全代入剧情，影片融入了爱情故事，很贴近这个时代，是一部具有国风情怀的国漫电影!,1106973708,田瑞,5.0,1
398,合肥,2,非常良心的一部动漫，真的很好看，超越经典却又源于经典，推荐大家去看！,1107026435,minrong,5.0,3
399,盐城,1,这…太垃圾…,1107045186,男人心666,0.5,4
400,湘西,2,还以为是花木兰 没想到是动画片版的 说的是动作 看出来是爱情,1107035951,                     .,0.5,1
401,辛集,,好看！！！！,1107037745,Goc753690244,5.0,2
402,三河,,故事情节一般，结尾很感人。,1107016604,fML414546130,3.5,2
403,上海,1,画面，色差还可以，情节一般，其实就是一部通俗的武功片转成动画片，好像情节都走不出这种套路03,1107008892,aFS596423798,2.5,2
404,广州,1,与想像中不一样，一个全新的花木兰。,1107011744,zsg1969,4.0,3
405,济宁,2,很好看感动演的很好,1107003902,a（抱起颖宝宝）～,5.0,2
406,西安,2,带小孩子一起看的，打斗场面比较多，可能会有点吵。这个应该算是花木兰的番外篇了吧，之前看过的基本上讲的都是大家所熟知的替父从军的故事，而这个另辟蹊径，讲的是关于花木兰的爱情故事，当然，里面的爱国精神英勇杀敌部分也是有的。推荐哦～,1107025396,PerkiYa,4.5,3
407,重庆,,非常不错，值得推荐！,1107003643,aXN168374047,5.0,2
408,钦州,,很不错的电影，非常好看，这个动画片很适合在国庆节看，其他电影小朋友都不是很喜欢，下次再去看一次。,1107022465,曾总0078,5.0,3
409,北碚,,亦非的表现无可挑剔,1107011121,符号～曾,4.5,2
410,响水,,中国人自己拍的木兰，果然接地气！虽然画面糙了点，但她过的是中原女孩自己选择的人生，这故事值得一个赞！,1107018108,lidamaomaomao,5.0,3
411,响水,1,作为合家欢动画还不错，全场小朋友们爆笑不断，给孩子们树立了报国典范！,1107020286,ZsA136716087,5.0,3
412,合肥,,可以和姜子牙媲美，希望过慢，越来越好，越做越强,1107012865,Tom,5.0,4
413,井冈山,,有好多槽点啊,1107017874,尘尘,2.5,1
414,徐州,,本以槭谴统的故事情节，没想到整个影片都是描述木兰从军过程中的故事，影片一开始就把木兰英姿飒爽的赓|展露无遗 ，一直贯穿到整个电影的结尾 ！非常喜欢！国内制作的勇已经非常不错了，鼎力支持！,1106876643,ai2jane,5.0,2
415,成都,,电影上映前在抖音上就看了个大概，还是很不错的，不然也不会在首映日就去看，最主要是小孩子喜欢。姜子牙我怕他看不懂，还是这种的简单快乐,1107013144,TGo547228473,5.0,2
416,沈阳,2,"刚开始看的时候很震撼，特别壮观的背景，还有草原王子的呆萌凸显出花木兰的英姿飒爽，结尾的团团圆圆
高品质动画片。推荐小朋友看一看。",1106996371,xuyun拥有幸福,5.0,4
417,深圳,2,好久没有看动漫了，特别喜欢花木兰穿女装的那一段，中国文化表现的栩栩如生，给动漫加鸡腿7815 ,1106989686,谢耳朵062822,5.0,1
418,钦州,,故事一开始花木兰就已经是将士，对熟悉花木兰的中国人来说，是可以不用赘述，可是在回忆和父亲的对白里，更像是父亲要花木兰来成军的。故事随有冒险爱情，靠着和亲解决了与草原的矛盾，军师和大帅的反水都在意料之中，除了花木兰还创造了另一个女子角色,1107009798,永远的流川枫,5.0,3
419,灵山,2,电影很好看，花木兰电影不错哦，希望别下啊，值得二刷，满分99好评，电影院也很棒，它家爆米花9515超级好吃！！！！！,1107009620,芒果5844,5.0,3
420,成都,,木兰横空出世，故事内容不错，在可以接受的范围之内，中国人的故事就应该自己来讲解,1107009471,胡萝卜,5.0,2
421,南京,2,今天带着宝贝看了木兰，她喜欢的英雄人物，电影的细节处理的很好，音效很棒，人物个性鲜明，很幽默，也很有爱国情节，讲述两国都很重视百姓生活，希望以和平方式解决问题，很好看的一部电话电影，值得一看,1107005393,jj_hsu,5.0,1
422,南京,,"国产动漫《木兰横空出世》讲述了花木兰替父从军，在一次孤身潜入敌营的任务中，险象环生，并由此踏上探寻阴谋之路,最终真正理解“侠之大者，为国为民”的故事。电影笔触细腻、美轮美奂的中国风场景，特别是大山大河的景色，超级棒！配乐随剧情发展，时而小桥流水，时而大气磅礴。剧情又以多民族和平共处为故事的导向，充分体现了“中华民族统一、伟大复兴”的主题，我觉得在国庆档上映，真的是太热血太给力了！",1106996175,就爱美食一,5.0,2
423,淄博,1,刚得到消息，本片自十月六日零点起撤映，复j待定！,1107007432,xykantan1954,0.5,4
424,龙岩,2,不咋滴，故事内容都改了主题,1107002908,海蓝蓝,1.0,2
425,亳州,2,小小时候就很喜欢木兰这个故事，现在看了记忆更加深刻，也更加喜欢了这个角色，木兰上的替父从军的勇气，以及他的孝心都是值得学习的,1107000997,西茶,5.0,2
426,青岛,,支持一下国漫，蛮不错的，剧情真的实在是太好看啦，大家赶快进影院看吧。,1106776778,Qlz305451192,5.0,2
427,天津,2,就是一个题目，写出了新颖的故事，动画做得不错，配乐也挺好，故事写得也比较饱满，有年轻人的气息,1106906800,神经蛙,4.0,3
428,吉林,,都说忠孝不能两全。但这部电影不但体现了忠孝两全！还做到了勇敢和真诚。挺好的，大家都去看看吧。,1106986575,xBD773765584,4.5,2
429,成都,,画面还是挺好看的，挺适合小孩子观看，推荐小孩子观看,1106998647,MyY608556428,5.0,2
430,合肥,,国庆期间去看的，很不错的动漫，可惜国庆大片太多不太显眼，但是质量真的很好，可以带孩子一起看,1106754075,aui138028599,5.0,4
431,辉县,2,"看着预报片还马马虎虎 然而老公对此评价很低
技术粗糙  平面的
怪不得推荐直接看英文版木兰

哎
难道真的看了善哉班",1106994762,杨:)震  Lucy Yang989903,2.5,3
432,南京,2,不错的电影，动画效果很好,1106993608,wuejdhd,5.0,2
433,牡丹江,,"今天观影木兰横空出世，真的太棒了
强力推荐",1101639921,妙圆（隐形针灸）,5.0,2
434,太原,2,"很久没看动漫电影了 感觉好陌生
花木兰的题材感觉也蛮新颖的
感觉进电影院放空了一下下",1106974674,Nzl155658601,5.0,2
435,咸宁,,烂片！！！！,1106994234,随便取个名a,0.5,2
436,青岛,,特别特别特别特别好看，很好的国产动漫大家可以带孩子试一试,1106995046,朱智林,5.0,1
437,锦州,1,很好的国产动画电影！人物栩栩如生，场景渲染到位，动作行云流水！我很喜欢啊！02,1106993180,MAO408814424,5.0,4
438,深圳,1,垃圾，垃圾，,1106991164,隔壁老王的在家呢,0.5,1
439,东莞,,很好看，整部电影都吸睛到尾,1106988333,养猫一族,5.0,2
440,三河,,这部电影非常给力，很好看。,1106984720,依然,5.0,1
441,廉江,2,这部国漫很良心了，很喜欢里面的木兰人物。可以带着孩子去看，一边娱乐的同时又可以教会孩子历史人物故事。希望中国可以多出这些国漫，支持国产啊……,1106971481,iLD606368055,5.0,1
442,上海,2,儿子更爱看，不错,1106938353,培祺 沫沫紫菜包饭,5.0,2
443,武汉,2,为了配音去的，阿格和军师的声音真的很好听，但是剧情能不能不要这么恋爱脑。,1106985822,花祭颜,4.0,2
444,成都,1,看之前其实期待不是很高的，看完感觉居然有意外，所以还是有点点惊讶的~,1106983361,Lillian,5.0,1
445,大连,2,利用国庆去看的一部电影，也是对国漫的支持，剧情不错，挺吸引人的，花木兰小英雄棒棒棒,1106987025,vUr700167513,5.0,2
446,沈阳,2,木兰的心愿，“当大官”“给老花家争脸”，一个没太读过书的封建礼教下的蛮横小女子质朴而世俗的愿望。一部很好看的动漫。,1106958918,亚历山大美丽,5.0,3
447,重庆,1,尬死了，cccc,1106979939,ad220a15-34a398,0.5,2
448,合肥,1,电影特别好看，剧情特别精彩，很好的民间故事，期望再出类似电影,1106982469,Save Me,5.0,2
449,深圳,2,非常喜欢哦！喜欢花木兰哦,1106982443,王伊柔,5.0,3
450,成都,,电影很有自己的想法，可以说诠释了一种不同的理念。更棒，感染力很强,1106979839,lgS643753105,5.0,2
451,蚌埠,,电影很好看，剧情很精彩，代入感强，期待第二部同类电影,1106983080,N爷94,5.0,1
452,长春,,"篡改历史 建模稀烂 水军众多 碰瓷大片
这注定被定在国漫的耻辱柱上
",1106974037,fTf637433527,0.5,1
453,成都,,横空出世，木兰为雄，霸气，帅气，不一样的木兰，超级好听的主题曲,1106983032,uqg502798397,5.0,2
454,南昌,1,很好看，确实不错，故事情节不错，加入了很多喜剧元素，加分，画面太美。很满意，票买得值,1106980880,UOQ448851395,5.0,3
455,成都,,"题材很好的一部片子居然被狗血的拍成了爱情片，我看完后，真后悔看了这部烂片。
导演不是把观众当白痴，那他就是个白痴。
请善待中国优秀主题的故事，不要难搞！",1106810220,老虎头上的太阳,0.5,2
456,忻州,,看了花木兰，有中国的传统元素，是值得看的国产动漫。,1106971046,温柔女人899,5.0,2
457,蚌埠,,这妆容太好看了，剧情吸引人，情节十分精彩，代入感十分强。,1106976830,RjQ233128614,5.0,1
458,南昌,,电影很好看很精彩！导演演员发挥都很棒，场景特效不错，祝影视长虹,1106978511,SBK151318100,5.0,2
459,福州,2,爱就会** 不爱也没有关系,1106978471,pointi,5.0,5
460,凤城,,影片的故事情节特别有趣，加上传统故事的背景，而且是国产动漫，给人耳目一新的感觉。支持国漫！国漫加油！,1106978455,UXQ368219804,5.0,3
461,沭阳,1,电影很好看哦 特别的有意思 孩子们的笑声也很欢乐 看着孩子们笑 我也很开心 哈哈,1106968185,jMN904289308,5.0,3
462,江阴,,别看了，只是披着花木兰的皮，还没看过打仗的时候谈情说爱还是花木兰和亲，烂死了,1106976494,薛小胖……,1.0,4
463,德阳,1,这几年的国漫总是不断带给我们惊喜，将在10月3日上映的《木兰：横空出世》亦是如此。这部完全由国人团队历时五年制作，以国画山水为底色，以武侠美学为看点的当代国漫，唯美展现北国壮丽山河的同时，也将“花木兰”这个独具东方女性魅力角色的飒爽英姿全方面展示。单机1000000小时渲染，单帧画面20000光线追踪，10000000级植被量，天量的制作工程背后，是一颗打造“精美国漫”的赤子之心，绝对适合带儿童一起观赏。,1106977578,TAO,5.0,1
464,南充,2,很精彩！中国动画电影一直在稳定进步！剧情很精彩！很期待以后的发展,1106970165,95妹丽星光9595999999,5.0,2
465,淮北,1,好看，主题鲜明，人物形象塑造完整，很有特点，适合国庆档与家人一同观看。,1106970822,是哈哈啊,5.0,2
466,郑州,,完全是一部爱与勇气的电影！故事内容有些无厘头！,1106977103,qiwei1982,4.0,3
467,亳州,,超出我的期待!画质精致，配音也非常好，看的热血沸腾啊，勾起小时候看花木兰的回忆，完全代入剧情，影片融入了爱情故事，很贴近这个时代，是一部具有国风情怀的国漫电影!,1106970673,好奇,5.0,1
468,成都,,这部电影挺好看的，比我预料中的还精彩一些，特效很不错，结局很美好，画面感很不错，花木兰很符合以前书里面读的花木兰形象！,1106969774,nNV721139455,5.0,2
469,扬州,1,串改历史，画面粗糙,1106951701,王中王,1.0,1
470,武汉,2,"经典的中国风电影、新的""花木兰""，小马倌，画风很好、剧情一般、收尾有点一急。特效一般。但做为中国制造还是十分推荐的一部电影、但不是很适合小孩子一起看。",1106970598,佳佳宝贝0205,4.5,2
471,扬州,1,值得推荐，画质很不错，中国传统文化故事还有很多，值得继续挖掘，中国动画动漫继续加油!!!,1106947902,M.petit,5.0,2
472,杭州,,可惜不能给0星 不然一定给0星呢,1106972865,长须小黑豹,0.5,4
473,合肥,1,电影特别好看，很精彩，特别好，期待出第二部电影，还会支持下去,1106973405,Mr,5.0,1
474,洛阳,2,《木兰：横空出世》一个颠覆传统木兰形象的全新故事，制作诚意十足，悉心打造的女英雄演绎出女性传奇风貌影片旨在塑造一个全新的国漫女英雄，给观众带来一个极具中国特色的花木兰形象。,1106972634,小卿1,5.0,3
475,化州,,国漫电影木兰横空出世# 这几年的国漫总是不断带给我们惊喜，将在10月3日上映的《木兰：横空出世》亦是如此。这部完全由国人团队历时五年制作，以国画山水为底色，以武侠美学为看点的当代国漫，唯美展现北国壮丽山河的同时，也将“花木兰”这个独具东方女性魅力角色的飒爽英姿全方面展示。单机1000000小时渲染，单帧画面20000光线追踪，10000000级植被量，天量的制作工程背后，是一颗打造“精美国漫”的赤子之心，绝对适合带儿童一起观赏。,1106973117,粤西彭于晏啊,5.0,2
476,漳州,,剧情比较老，基本上都猜得到，但是场景还不错,1106969211,昔年,3.5,2
477,南充,2,很好看 中国动画电影一直都在进步！画面渲染得很好！,1106973035,MLUK,5.0,4
478,重庆,,感觉一般、故事剧线太长，没亮点,1106963929,余泪,3.5,2
479,洛阳,2,很有意思的影片，在场的观众看影片的情节逗的大笑，木兰在战斗中，从坍塌的水泥板出来的那一刻也就是木兰横空出世的一刻，结局完美，木兰和王子一起走江湖品美食。,1106963735,紫沙清影,5.0,2
480,黄冈,1,无聊死了   画质也垃圾,1106962774,浓度,0.5,2
481,郑州,,咋说呢，快跑,1106961937,wsxgsa,0.5,2
482,本溪,1,画面还行，故事情节一般,1106962616,Aa 97、 盼  盼,4.0,1
483,广州,2,孩子今年6岁表示电影很好看，台词没有很难懂，还有明显的笑点，国庆档就只有这部电影适合低龄孩子了，能同时照顾到儿童和大人的观影感受。,1106862833,lady_joyce,5.0,4
484,广州,,影片展示了一个不一样的花木兰，跟从小了解的故事有所出入。同样是代父从军，一开始木兰的身手了得，并且误打误撞下认识帝国的王子，通过相知相识感受到爱情的美好！同样，该片动作部分的动画制作精美，能看的出来国漫的进步。,1106655280,tian.tian.1984,5.0,3
485,广州,,"很开心上映当天在电影院看了动画电影《木兰：横空出世》：
1.在今年第19届全国院线国产影片推介会上，又发现一部纯正国风的国漫电影《木兰：横空出世》。
2.歌曲很好听（主题曲和片尾曲），片尾都可以听到，尤其张碧晨演唱的片尾曲《木兰心》。
3.配音演员还是蛮赞的，由张琦、赵路、邵敏佳、贾邱、韩秀一等优秀配音演员进行配音的。
4.期待《木兰：横空出世》能成为国漫代表性的花木兰。",1106649496,FXx645579500,5.0,4
486,成都,,完全不一样的花木兰！个人感觉还是很特别的！看完以后想说的挺多的！,1106964075,noG720575061,5.0,3
487,石河子,1,有点不好看啊,1106962209,艺欢万人迷！,2.5,1
488,三台县,,"花木兰一直是心中勇敢女性的代表人物。她不惧生死，不顾情长，是不平凡的女子。她并不柔弱，她传递着非凡的家国情怀，优秀的民族文化，与挑战世俗观的战斗勇气，不论时代再怎么变迁，她在未来还必将持续散发着励志光辉。
",1106959913,fwg447151721,5.0,2
489,厦门,2,支持国漫，细节做的很到位，很精彩！,1106956769,Jack.,4.0,2
490,乌鲁木齐,1,垃圾东西打着国漫旗号出来骗钱还碰瓷迪士尼，******，,1106956572,梦里不知身是客,0.5,2
491,柳州,,烂到极致……,1106959218,Fantasy,0.5,2
492,丹东,2,出乎意料，却又在情理之中，好棒！,1106954902,滢滢,5.0,1
493,深圳,,垃圾电影，难看,1106934702,NpA385896813,0.5,2
494,天津,,太难看了也，制作先不说，这个剧情是个什么玩意？木兰和阿格的爱情故事？横空出世呢？这个剧情也太尬了，有的话都不知道从哪冒出来的，无比尴尬，毫无看点，笑点也很无厘头，也就小孩子还能笑的出来，太难看了也，一点也没有可感动的点。而且木兰要是被认出女的来了，不应该是震惊和害怕吗，这要是被知道了不就是砍头的罪吗？这剧情，直接就开打？？？啥玩意。剧情真的很尬，看到她和阿格，我都想拉进度条，很尴尬，也很没理由，本来就是当兵的，还被认出来是女的了，不赶紧的避嫌，还有事儿没事儿都跑出去玩？拜托，这是打仗，打仗！好吧！弄的像平常被约出去的家教严的小女孩一样。希望国漫不要拿观众当傻子好吧，这不就是在给国漫抹黑吗,1106932775,Mkx284600799,1.5,2
495,哈尔滨,2,"这部动画片里的木兰属于艺高人胆大型的，英姿飒爽，又有灵气。
动画制作的还是很精美的，场景很逼真，故事也紧凑有悬念，最后识破了军事的阴谋，结局挺好。",1106957263,陈赴梅,5.0,3
496,北京,2,看预告时就很期待的一部电影90，画风优美，中国元素很多，飘舞的长裙和长发的花木兰特别的酷！打斗场面精彩，音效也很不错！,1106954557,BHY471553796,5.0,3
497,长治,1,看的我好尴尬,1106954553,楠～,0.5,2
498,钦州,,不是所有自称创作了四年的电影都是《哪吒》和《姜子牙》。但是在经历了好莱坞《花木兰》的“洗礼”后，国产的《木兰》打一回翻身仗。,1106953407,王全安是我,5.0,3
499,昆明,,不错的体验！画面效果很棒！剧情还可以！,1106953733,LyH945116616,5.0,1
500,青州,,不得不说真的佩服该公司的勇气敢选在国庆中秋双节同庆的假期上映，谁给的他们的勇气呢。难道是洗钱？！,1106954415,冰枫龙行,0.5,4
501,通榆县,,挺好的 故事挺感人的 就是剧情有一点单一,1106953667,Curry.,5.0,3
502,梅州,,**太好看了 今天抽空和朋友去看的 支持国漫 感觉国漫真的越来越好了 剧情非常给力也很好看 孩子很喜欢,1106948950,我外卖贼香,5.0,2
503,抚顺,1,挺好的！就是情结过于单调些,1106948900,无言以答,5.0,2
504,洛阳,2,挺好看的。。。。,1106945924,lly_84,5.0,1
505,无锡,,难看到窒息！,1106934420,Orekai33,0.5,4
506,广州,,挺不错的又回到了童年的感觉，色彩丰富孩子既能了解历史又不失童话趣味。非常棒！,1106646270,Lのように,5.0,3
507,昆明,2,"？？？？
一开始看到木兰，以为是很酷的那种，结果发现……太过了，越看越懵，怎么变成了莫名其妙的爱情故事了？不是说不可以改，但是，改的好尴尬91",1106949771,91,2.0,2
508,钦州,,这剧情改得真是大爱！用爱拯救世界，只有爱可以包容一切！就让我们包容这部片吧！用爱理解导演！用爱理解这个不是木兰辞的故事！用爱发电！,1106929560,合法人872,5.0,3
509,重庆,,好看！不会是大片！,1106944535,潇洒狐公子,5.0,2
510,巴中,,这个电影虽然没啥人看，我觉得应该支持中国的国漫。花木兰的精神值得每个人学习,1106929473,VuE268779938,5.0,3
511,北京,2,太恶心了 今年最差片,1106941921,fei,0.5,2
512,凤城,,支持国漫，还是很好的一部片子，以国产故事为基础的电影，应该支持，故事情节，动作设计都还是不错的。,1106949043,oLf927295599,5.0,3
513,成都,,不好看。浪费钱,1106840895,云遮月,0.5,3
514,成都,,除了女主叫花木兰，剧情跟花木兰没什么关系，里面代父从军这件事所有人都知道，就不知道她是个女的。还有把花木兰写成一个无脑一根筋的人，除了最后几分钟醒悟过来。有几段感觉是为了凑时长硬加的。还有开头讲各种乱世，结果结局是男主和女主去全世界吃喝和当游侠。。。。还有突然就出来的爱情线，画风应该是没什么钱，质量一般。刚开始还想画风不好剧情在线也行，结果剧情也很无聊。,1106943853,GOT000,0.5,3
515,肇庆,2,和平比较重要,1106943804,郑,5.0,2
516,深圳,1,我们的花木兰、我们的巾帼英雄，故事应该由我们自己讲，当然也要讲的漂亮。《木兰：横空出世》从技术上说是首部三维动画呈现的作品，人物塑造和美术都有非常棒的呈现；从故事上说，既做到了承袭经典，也做到了创新，一改以往一成不变的视角，花木兰终于有了独立人格、也有了自我认知，她不再是被迫从军，而是从小就有侠女梦想，她在军营一路成长，最终实现自己的价值。这样的人生观、价值观不正是新时代女性所拥有的吗？这一点更容易引起观众共鸣。,1106934095,孤烟,5.0,4
517,凤城,,做为国产动漫还是很不错的，故事很有意思，动作也不错，喜欢中国传统的故事，值得一看！,1106942918,BVH875299727,5.0,2
518,龙岩,,买票像交智商税,1106939676,おかね98,1.0,2
519,湘潭,2,就不咋的呀呀。,1106943630,肥皂泡泡,1.5,2
520,合肥,,可以可以，值得一看 期望会有下一步电影出来看一看,1106939549,参 商,5.0,1
521,哈尔滨,1,小到飒沓似流星的木兰女装，大到留白风格的国画山水与家国情怀，《木兰：横空出世》以十足诚意讲好了一个热血与温情并存的中国故事。“万里赴戎机，关山度若飞。”无人不知无人不晓的木兰传奇，通过国漫方式演绎出来同样别有一番趣味，很适合带孩子一起看。这个国庆，且看木兰征战沙场！,1106943519,0112,5.0,2
522,大连,,很好看 剧情合理内容丰富 铁宕起伏 很推荐大家观看 电影内容丰富 非常的好看 画质清晰 影院的座位舒适,1106928907,czd666783530,5.0,3
523,长沙,,没仔细看，花木兰下架了，被这个给骗了，以为是刘亦菲的花木兰！这个片子太烂！,1106942529,寓765,0.5,3
524,忻州,,孩子是奔木兰去的，内容很喜欢,1106940452,小燕子,5.0,2
525,烟台,2,还可以，带孩子看,1106937942,cherry_yj,3.5,2
526,成都,1,"一随明月出关山，百战黄沙十二年。

巾帼何辞戎马事，不教西北有狼烟。

-------致 木兰",1105823277,lwhandwlg,5.0,5
527,广州,,电影画风很唯美，花木兰故事正能量，适合一家大小去看，小孩看着笑声不断，国庆推荐去看电影。,1106931886,babafung,5.0,3
528,杭州,1,支持国产动漫，拍得挺好的，,1106931845,沙漠之鹰,5.0,2
529,揭阳,,"剧情好棒棒喔！
我觉得我历史白学了！
看到睡觉了！
呵呵哒！",1106937444,桌爽,0.5,2
530,泰州,1,我堂堂华夏，不怕死的人有的是～国庆假期这句台词说的是深入人心，一直觉得木兰应该有一个美满的结局，当时的历史背景下，确实如果木兰和草原王子的还不错的结局吧，如果有一个中原儿郎杰出表现那就更好了，大爱，很满意的一场视听体验,1106892969,shengge946,5.0,1
531,上海,2,花木兰替父从军，从未出嫁的少女变成战场厮杀的女将  坚毅 向往 彷徨，好在师父指点迷津 斩杀女巫 亦菲女神一如既往演技在线 推荐,1106933525,_qqhks1379320376,5.0,2
532,上海,,太棒啦！不错的,1106935483,Ah^,5.0,2
