,城市名称,用户性别,评论,用户id,用户昵称,用户评分,用户等级
0,永康,1,李鬼碰李逵。和迪士尼碰瓷碰成**。。。。,1111192416,人男小,2.0,4
1,天津,,还可以！欠缺一点,1111172312,妞宝栗子,3.5,3
2,呼和浩特,2,片子比较一般,1111148235,ISm198390570,3.0,3
3,玉溪,1,差不多，国产的支持一下,1111115048,CrooKed摩登,4.0,2
4,大同,,孩子喜欢的影片,1111052852,piU260645848,5.0,1
5,深圳,,非常的喜欢哦,1111033223,一一独一无二,5.0,2
6,北京,1,不好看，给小学生看的,1110868994,NMc126309432,0.5,2
7,成都,,木兰：横空出世，画面感优美和谐，有巾帼英雄的魅力，也有身为女子不输男儿的担当，小小的故事从中也能发现很多大道理。这是一部值得看的电影。,1106775205,十三,5.0,3
8,乌鲁木齐,,"（我是一名迪士尼的粉丝）这部电影虽然说是蹭热度，但是凭那一句拍中国人自己的花木兰，我决定还是期待一下，毕竟还是希望国漫越来越好，但愿导演能对的起他打的宣传语。
   上映后回来打分，导演HB",1092534705,三杉麂鹿,1.0,1
9,淮北,2,就是个打着花木兰幌子实为谈恋爱的电影。看到一半给我看困了。无语。,1110679837,Audrey阿黎,2.0,1
10,湘潭,,以为是神仙姐姐演的那个,1110634893,lBc476221950,3.5,2
11,本溪,,支持国漫.7815,1110542117,iWh942346062,5.0,2
12,扬州,,和朋友一起去看的，旁边好多小朋友，哈哈哈哈，一起看的时候可激动了。,1106673491,aPp373394695,3.5,2
13,阳江,2,有点，无聊。,1110465472,RPv402156669,3.0,1
14,中山,,不错，挺好看的,1110443910,fsT248194686,5.0,2
15,天津,2,挺不怎么样！,1110393935,_qq2wd1344172957,1.5,3
16,吉林,,一部动画片。,1110348022,JDB310808384,1.5,2
17,乌鲁木齐,,很好看，值得一看！,1110325670,xjgot吃喝玩乐,5.0,2
18,北碚,1,体验感很好！,1110302299,gno29993306,5.0,2
19,洛阳,,豆瓣上都3.4了，看来好评都是花钱找人刷的，就这？,1095410471,空帮瓦,0.5,2
20,贵阳,,孩子还挺喜欢看的。,1110196743,huangmingyu_2008,3.5,2
21,合肥,1,好看不错！建议看看！,1110196514,fPr707141368,5.0,3
22,成都,2,给妹儿买的，还不错,1110168965,ayazai,4.5,2
23,阿拉善盟,2,今天穿了一双老想去找你的鞋90,1110165802,道日娜559,5.0,3
24,长沙,,带着小朋友去看的，小朋友比较喜欢。,1110135406,wanghehust,3.5,2
25,济南,,人物精美，格局不够，没有大场面,1110118788,gEh906784965,3.5,2
26,慈溪,,好看的我认为,1110075704,Jikx0411,5.0,2
27,合肥,,无法描述的烂！说是新编，但怎么就成爱情片了？无语,1110036198,QPJ711714878,0.5,2
28,平湖,,好看不错96,1110002390,Du2165,5.0,1
29,成都,,还好吧，儿子很喜欢,1109971398,UfD549365241,5.0,2
30,慈溪,2,武打画风很精彩，画面很唯美,1109925653,KYl551858346,5.0,2
31,郑州,2,中途拿出了手机在玩游戏 实在是无聊,1109898831,不必打扰nn,1.5,2
32,广州,,支持国产动漫！,1109838658,hda196400099,4.0,2
33,淄博,1,还不如之前动画片,1109869113,白笙1027,2.0,1
34,广州,,比较新颖，国漫越来越好了,1109825828,IjH811695352,4.5,3
35,沈阳,,"太差了，不好看！
",1109824843,HMC201985667,0.5,1
36,湘潭,,emmm，适合小孩子看。我进去看了之后就有点后悔买了，剧情对我来说没什么太大吸引力。受众应该是小孩儿,1109794556,zDp936968721,3.0,1
37,贵阳,,嗯，还可以吧。,1109786961,ulf963692903,3.5,2
38,萍乡,2,妆容古怪都算了，还巫术。迪斯尼这么歪曲我们的花木兰吗？,1109786901,christy,4.0,5
39,扬州,2,"  
   ",1109782631,撷瑞,4.5,1
40,哈尔滨,1,非常好看的动画电影,1109671922,陈碧桐,5.0,4
41,北京,,非常喜欢很好看,1109603317,vcszj,5.0,2
42,莆田,1,太垃圾了，看的睡着了,1109600526,chenshun5223,1.5,2
43,西宁,1,下面这段话就是为了凑字数。,1109538531,梵洛音灵,4.5,2
44,锦州,2,好看就对了。,1109527220,慕煦.,5.0,2
45,呼和浩特,2,看她看她看她。国漫威武！前有迪士尼的花木兰，后有期待值爆棚的姜子牙，那都不重要，重要的是木兰会有在人们心里！,1107354868,bsX741247503,5.0,4
46,广州,2,一般般的动画，跟木兰没啥关系的感觉,1109494167,ZVO554065081,2.5,1
47,长春,,剧情可以画面挺不错的，大孩子去看的很高兴。民族英雄也是个情怀吧，虽然改动挺多总体不错。,1106657242,Epi385240747,5.0,3
48,三台县,,还是挺可以的,1109437344,临江仙お,5.0,2
49,上海,2,总体来说还可以吧,1109428458,繁A^後如,4.0,2
50,南昌,2,一般般，没有很惊艳,1109434022,dailu8866,3.0,1
51,兰州,1,看电影的人说，很无聊。,1109397508,水煮艹鱼,1.5,2
52,重庆,,画功不错，只是人物刻写似乎与历史上的有所不同,1109352426,王晶晶844,3.0,3
53,沈阳,1,支持国产动画，支持华语题材，支持传统中国故事，由于去年哪吒的异军突起，似乎带起了一股可喜的国产动画风，大闹天空年代久远，哪吒闹海也有几十年了，哪吒之前国产动画最新记忆还是宝莲灯。《木兰横空出世》在《哪吒》之后与大热潜力股《姜子牙》同期公映，是国产动画之喜！,1106625720,kevinet,1.0,4
54,武汉,1,画面精美，剧情引人入胜跌宕起伏，很好的讲述了木兰的故事，剧情同时也很感人，会推荐朋友们都去电影院看一看。,1106710254,cKa416243891,5.0,5
55,哈尔滨,,还行吧 还行吧,1109283393,Zxn747553458,4.5,1
56,昆明,,嗯。。。还好吧,1109248647,一丢丢的快乐,2.5,2
57,郑州,1,制作并不算精良，故事一般吧，不好也不赖,1109247552,aHF856457267,3.0,3
58,太原,2,还可以吧。。。,1109158711,忘我则柔289,5.0,1
59,海城,,整体的效果还是不错的,1109108377,JulnyJ,4.5,2
60,乳山,2,没有相像的好,1109014163,ysb435023561,4.5,2
61,天长,,还不错的，小孩说喜欢看。。。。。。,1108985391,Cdg209804406,5.0,3
62,重庆,1,剧情较好，动画效果不是特别好、但也勉强，还是可以看一看的。,1108875730,微风之语,4.0,5
63,北京,2,真的...一言难尽,1108735724,卟哩酱,3.0,4
64,淄博,2,还好，改变挺大,1108716676,gaohuagao,4.5,3
65,大连,,还好吧，陪妹妹看的,1108710943,Deep........,5.0,2
66,南京,,绘画水平不行，只能勉强及格,1108687474,fcbb11fb-8f0782,3.0,2
67,深圳,,还是挺不错的,1108632134,UzZ443797700,5.0,2
68,牡丹江,2,效果故事情节都太一般,1108610652,gwA407137266,2.5,2
69,南京,,还可以，就是情节简单,1108534583,cFm157221027,4.0,3
70,合肥,,吐槽的人都是没真正看过的吧，我觉得很好看呀，建议你们还是亲自去影院观看，带着弟弟妹妹一起,1106880336,我是一个柠檬精。z,5.0,4
71,泰兴,2,"为什么要在下着暴雨的凌晨一点开车40公里出来看呢？家里的床不香吗非要这样对自己呢。
唉算了中国国漫还是应该支持在行动上。",1108479602,陆家嘴肉包啊呜,3.0,4
72,深圳,,棒棒的呀饿得,1108478745,jinvenusxing,5.0,3
73,北京,,还可以，孩子愿意看,1108443189,GML564211339,2.5,2
74,长春,1,电影很好，期待下一部,1108382687,看到我让我滚去健身,5.0,1
75,广州,,大部分都可以，最后打boss败笔,1108374029,timtimpig,3.5,5
76,扬州,,还想在看一遍。29^70^29,1108344124,cdz274558860,5.0,2
77,广州,,小朋友看可能好看些,1108312541,ydy835946397,3.5,2
78,南昌,2,感觉还挺不错的，内容挺精彩的。喜欢喜欢。,1108273789,咚当,5.0,2
79,黄石,2,好看 动画特效特别好  真的 太好看了 喜欢喜欢,1108294768,tGO685343062,5.0,2
80,武汉,1,花木兰这部影片把替父从军的故事线，表现的非常不错的！,1108280371,时之沙286,5.0,1
81,上虞,1,很不错，太精彩了，真是一部很棒的电影啊,1108280348,爱栗,5.0,3
82,南宁,,很好看，一直很喜欢花木兰，影片里的花木兰是我喜欢的,1108232202,yiz607011619,5.0,1
83,南宁,,别人推荐看的，题材新颖剧情也是相当的给力完全达到预期！,1108273488,ZEV1988,5.0,1
84,慈溪,,还可以吧，不错,1108285499,keyesfang,4.0,3
85,余姚,2,很轻松的一部电影,1108270963,健身小公举,4.0,3
86,南京,2,不错，值得一看,1108246199,ydW882700189,5.0,3
87,北京,1,带着家人一起去看的。,1108245938,染年凉城情似瑾,5.0,4
88,绵阳,,全家人都可以看的一部电影，画面很唯美，动画人物都很有个性，推荐观看,1106638055,sxt783,5.0,4
89,威海,,终于有了自己的国漫  无论是剧情还是音效  都很棒  中国国漫真是不鸣则已  一鸣惊人！,1106783815,会飞的佩琪i,5.0,1
90,固原,,吼吼吼吼松坡婆婆,1108193382,djdjhdhxjj,5.0,4
91,哈尔滨,1,国漫木兰横空出世的作品完成度超越真人版花木兰，电影中将巾帼英雄木兰的形象完美呈现在大银幕之上，是一部优秀的国产动画电影。,1108167675,繁星启程,5.0,3
92,哈尔滨,1,富有心意的木兰故事，从传统的古典诗词到真人版花木兰，再到动画木兰，木兰的故事一脉传承延续了巾帼不让须眉的爱国精神，希望木兰的精神能永远在中华大地的沃土上生生不息。,1108184505,繁星雨巷,5.0,3
93,南阳,,好看，孩子超喜欢,1108167352,飞雨飞雪624,5.0,2
94,成都,2,不错的动画片,1108169606,kbW544277579,4.5,3
95,沈阳,2,这一次她金戈铁马，再到你的面前，英姿飒爽横刀立马，转身和银幕下的你打了个招呼，便直奔敌营虽千万人吾往矣，再演一段银幕传奇。,1106611724,北堂馨儿3,1.0,5
96,海安,2,不好看，没有感觉,1108163237,wuzixuan818719,0.5,2
97,天津,2,跟花木兰有什么区别,1108150054,蔷薇花语666,5.0,2
98,上海,,陪小朋友看看而已,1108124999,Gth941223940,2.5,2
99,昆山,1,挺好看的。。。,1108107982,qizheng_jiang,5.0,1
100,盐城,1,一般，带宝宝看，宝宝不是很喜欢,1108127109,猥琐无罪,2.5,1
101,佛山,2,嗯哼？？？？,1108107145,wadasiwalin,4.5,2
102,上海,1,感觉和长城一个水准,1108075634,图乐,0.5,2
103,成都,,挺好的，国产动漫加油,1108071113,王雷122,4.5,2
104,哈尔滨,2,爱情片，但很感人，挺好。,1108031553,小迷糊LZL,5.0,2
105,长沙,2,很棒！与想象一致！小朋友很喜欢,1108042781,alsj1008,5.0,3
106,上海,1,比饱受诟病的刘亦菲版好看那么一点，就好那么一丁点。毕竟国漫崛起，值得鼓励。。。再同比《姜子牙》，格局和规模都小了很多，但好在简简单单，老老实实的讲了一个俗套的偶像剧爱情故事，颠覆了传统木兰的全新剧情创作。虽然这个新创作大人看了会比较幼（ruo）稚（zhi），所以还是更适合小朋友观众，他们看得超级开心，结束了还都不肯走。,1106522941,HVF721321498,2.5,2
107,原平,,没有期待中好看,1108029448,陌言620,1.5,1
108,南宁,2,不恋爱就不能成一个故事吗？为什么非要恋爱？为什么非要和亲？花木兰如果真如电影所说的。怎么可能“同行十二年，不知木兰是女郎”,1106644347,血玉狼狐,0.5,3
109,成都,2,蹭热度的片子 这个版本的花木兰实在不喜欢 剧情也不喜欢,1107981402,长毛怪兽,2.5,2
110,昆山,2,效果不错！出票很快！人不多，观影愉快！,1107938331,wcX324614048,5.0,2
111,沧州,,还可以 也没有特别的,1107960195,oTy350638026,4.0,3
112,南宁,1,木兰横空出世是中国喜剧动画片，木兰替父从军保家卫国是家喻户晓的故事，女儿更胜男儿郎。木兰心系山河。在兵临城下时化干戈为玉帛，共御外敌，转危为安，是一部颇有观赏价值的电影，点赞！,1106818806,沙漠绿洲,5.0,3
113,大连,,不错 孩子很喜欢,1107951690,Andywdpx,5.0,2
114,重庆,,"国风动画《木兰：横空出世》给人的体验感受很新鲜。它延续了木兰这枚经典传统IP的精髓，又融入了新时代、新女性的诸多元素，让木兰这个角色更立体、更丰实，也更贴近现实、更有共情。
中国故事中国表达
没有中国的血液，怎么会懂中国的传统文化！果然中国木兰的故事还是要中国人讲。
张碧晨演唱的片尾曲「木兰心」，融合《木兰辞》的戏曲独白和一段琵琶独奏，展现了木兰柔情细腻的一面，令不少网友直呼“戳心泪目”。一曲木兰心，唱尽木兰情。",1107949613,OpQ750813424,4.0,3
115,钟祥,,好看的好(7070),1107896306,pink粉无限,5.0,2
116,深圳,2,一般吧，不太好看,1107885826,wXv913880846,2.5,2
117,西宁,1,电影一般，其他还好,1107856667,张C8899,5.0,1
118,内江,,不是想象中的好看,1107867588,丿青丘§梦魇,2.5,2
119,安吉,2,真的好烂，看不下去了，本来的木兰是替父从军征战沙场，但是电影里的木兰搞对象去了，这剧情真的是无语死了，里面的花木兰脾气差，技术一般，还没有配角让人觉得好，电影看了还没一半一个小朋友就跑出去玩去了，连小朋友都看不下去了，真的是交了智商税,1106665572,骆闻舟.,1.0,2
120,本溪,,太一般了！！！孩子看的,1107846015,风风火火过大年,3.5,2
121,上海,1,非常好，花木兰真令人佩服，不比男儿差,1107832361,珏了珏,5.0,1
122,广州,,好看，很喜欢刘亦菲，想起了儿时木兰的最初印象,1107838082,Zj人在江湖,5.0,1
123,烟台,1,不错，值得推荐一下→_→,1107812844,冰色糖葫芦,4.5,4
124,成都,1,下片了么？还没来得及看勒,1107833939,雷凯,5.0,4
125,常州,2,以为是木兰代父从军，其实是编外。小朋友要看的，就随便看看吧,1107828890,liwentingmt,4.0,2
126,靖江,2,还行吧，中年人的无奈和挣扎,1107829593,SZ阿静,3.5,3
127,安庆,1,可以，很不错的,1107802953,西西可里_,5.0,4
128,贵阳,,太烂了啊！！,1107805662,mimosa112,0.5,1
129,桐乡,2,还行吧，这部剧,1107810214,yKp442404208,5.0,3
130,沈阳,,谁看谁后悔，,1107781736,bsX6996269,1.0,2
131,慈溪,,都没去看！咋知道好不好！58分钟就不能退了！坑,1107799095,黄央炯456,0.5,3
132,福鼎市,2,半颗星给辛苦看完电影的观众。,1106755200,不是然然,0.5,2
133,上海,2,是一部不一样的花木兰，,1107792054,yu900618,3.5,2
134,合肥,,无论网评怎么样 宣扬中国风采就是一个好的作品！,1107752155,是甜天阿.,5.0,1
135,吕梁,,只有中国人才能拍好中国故事。真人片如此，动漫作品也亦然。《木兰：横空出世》虽是动画电影，却真正展现出中华文化的神髓和精义。影片在故事层面有创意；人物形象易让观众喜欢和接受，甚至可以说是惊艳；在制作上技术精良，中华美学精神处处可见。,1106641805,大亲爱。,5.0,2
136,北碚,2,电影不错哦，小孩喜欢看,1107733703,zhaojiexie,4.5,2
137,西安,,这个电影丰富了花木兰这个任务在我这种的形象！非常值得一看！,1107728938,小丑般的玩家,5.0,2
138,嘉兴,,好看的呀批，大家喜欢的可以看起来了,1107753431,uoe446295995,5.0,1
139,徐州,,非常不错的一部片。和女朋友一块儿去看的，都比较喜欢，大赞大制作。,1107751363,莘rrr,5.0,1
140,怀化,,很好看的一部电影，中国人自己拍的就是感觉不一样，很好看哦，大家都来看。,1107750093,UNX179098536,5.0,2
141,临沂,,太好看了好喜欢啊好看,1107742758,Tcm556534356,5.0,2
142,吉林,1,国产动漫越来越好了，看了哪吒和姜子牙，这个同样很好91,1107748165,锋1138,5.0,2
143,武汉,1,很不错的片子，适合一家人去看，画质很好！,1107747129,王刚1388,5.0,2
144,九江,2,男主主和女主的演技都好到炸裂裂，剧情非常常精彩很好好看,1107747059,花街良人,5.0,1
145,北京,2,孩子喜欢看   ,1107718885,kj520202,5.0,3
146,锦州,2,支持国产动漫,1107741235,米粒妈妈0112,4.5,2
147,奉节,,看了几分钟就想睡觉了,1107729034,THE833867579,0.5,3
148,郑州,,整体感觉很不错,1107661156,则缨,5.0,2
149,武汉,1,好看，剧情不错,1107719737,鸢语慕郡年,3.5,3
150,天津,,孩子同学都喜欢！不错！,1107707417,Yzb221480184,5.0,2
151,南宁,1,糟糕的建模，糟糕的台词，糟糕的剧情。开局十分钟这电影就看的我尬得不行，编剧就不能走点心吗，对战双方直接叫草原军跟中原军？一只蝎子比营帐还大？这部电影应该直接划为奇幻古装爱情偶像剧。电影用实力证明不止是国外的片方（某迪士尼）会亵渎中国文化，花木兰直接变成了追求家庭功名利禄的人了？堂堂王子因为一个女人就无脑出兵？大军兵临城下谈情说爱？当着几十万大军在马上抱来抱去就停战了？然后强行讲道理，这不是烂片是什么，那些说好看的都是托,1107012188,Timo,0.5,3
152,郑州,,还不错还不错,1107700445,sweet13214,5.0,2
153,商丘,,花木兰的故事很小的时候就听过了，看完这部电影又温习了一下花木兰的故事，电影非常好看，推荐大家来看，钱花的很值,1106765346,盼盼盼啦,5.0,2
154,保定,,花木兰的故事大家都耳熟能详，但这部影片用动漫生动的演绎出了花木兰的事迹及爱国精神，非常值得推荐，真的非常好看,1106763639,McM628807325,5.0,3
155,苏州,,牛皮吹过头了吧989898,1107597457,e498045d-c48530,0.5,4
156,武汉,,能文能武的木兰值得我辈学习，替父从军的精神值得尊敬，愿我们能成长为如木兰一般的大树，庇护家人,1107670340,OFQ213325195,5.0,3
157,商丘,,"花木兰横空出世真的很好看，声音炸裂，特效细致入微，木兰诗熟读百遍，不如进入影院看一看。木兰虽为女儿身，但胸怀天下志，替父从军，征战沙场，守家卫国，是当之无愧的巾帼女英雄。抱赞,值得去看。真木兰，真英雄。",1106632479,A yu,5.0,5
158,郑州,,木兰-横空出世 这部电影是我今年看的第一部动漫 和我的外甥一起看的 他表示十分喜欢这部的动漫电影 很有时代教育意义,1107660985,jBi223662391,5.0,2
159,郑州,2,这部电影十分适合带着孩子们到电影院观赏 改电影不仅可以作为国漫一个比较好的开端 而且也是可以作为教育孩子引领孩子们健康成长的良好素材 推荐观影,1107634982,故执813,5.0,3
160,郑州,1,《木兰-横空出世》这部动漫是一部出国产电影 这一点是十分值得我们国人称赞的地方 对于这不动漫的画质我想说这是一个大胆的尝试 是纯正国漫的开端 推荐大家走进影院观赏该电影,1107658681,kyP905990220,5.0,2
161,白银,,孩子自己去看的,1107658480,jiahuima,5.0,1
162,南京,,跟宝宝一起去看的 还不错的影片,1106961032,dVn583035608,5.0,2
163,睢县,,花木兰的故事各位观众可谓耳熟能详，此番再现大银幕，而且是以动画形式真心看点颇多。这个国际化的大IP最终观感呈现了不俗的特质。他们秉承“中国人的故事中国人自己讲”的理念，抓住了外在中国化的山水美感与东方意境，以及内在国人才有的那份思乡思亲和家国情怀，内外兼修，让这个耳熟能详的传统故事再次焕发魅力，呈现出熟悉又陌生犹如“这么近，那么远”的质感，有着不一般的观赏体验,1106801174,ΘΘ,5.0,3
164,南京,1,非常好看的一部电影 纯正的中国元素,1107634742,Harry康,5.0,4
165,南宁,1,生动有趣的国漫，替父从军的英勇木兰，令人感动，国漫加油。,1106841189,茧。，,5.0,5
166,睢县,,华美的中国风建筑，是对祖国文化的大力宣传，让人惊叹画者的想象力和创造力，有一种想去看看的冲动。打斗场面比真的武侠片还出彩，中国功夫大放异彩，徒手，轻功……只要是武侠片中有的，片中都有，只有精彩，没有不足。,1106781469,pFC894079618,5.0,3
167,南宁,1,很棒的国漫，很有趣，为我们展现了国漫的精彩，也增加了我们对木兰的喜爱。,1107636539,aEw866705326,5.0,3
168,太原,2,很好看， 和女儿去看个电影，古有花木兰替父从军，望今有朵儿成才！,1107652792,陈小唏,5.0,3
169,成都,2,剧情非常一般 非常一般 支持国产动漫电影吧,1107647840,娇姐0211,2.5,4
170,乐清,1,很一般很一般,1107647609,痕痕仔,4.0,2
171,郑州,2,和以往花木兰题材的影视剧不同，这部木兰横空出世是全新的内容，非常的具有新意，令人眼前一亮充满好奇，十分想知道下一秒的内容是什么，另外，作为一部国产动漫，其制作精良，画面动作流畅，内容积极向上，和迪士尼动画片花木兰相比虽然有所不及，但已经不错了，我看到了国产动漫的希望。,1106628937,雪莹韩,5.0,5
172,衡水,2,真的是动画片,1107642788,Knv456788262,1.5,2
173,徐州,2,不错96闺女喜欢看,1107645435,FJo712830499,4.5,2
174,舒兰,,不好看诶，有史以来第一次看电影看不进去了，真的太烂了,1107641729,HFR404552261,0.5,2
175,宜宾,2,个人觉得观后感不错，我觉得也挺有中国的一种特色的，里面的配音也不错，推荐带小朋友来看下,1106769490,klv753740098,5.0,3
176,宜宾,,全新的故事 全新人物   剧情热血     人物刻画细致 一点不输迪士尼的动画 国漫真的是越来越棒了,1106848166,kJH562133775,5.0,1
177,浦江,2,木兰：横空出世可以说是 国庆档最适合带孩子看的电影了，这是一个让孩子们学会成长的励志故事，也能让成年人感同身受，受益匪浅。,1106607559,猪八戒哥们儿,5.0,1
178,宜宾,,新出的国产片，放假带上小孩一起去看，孩子全程聚精会神在看，最美好的亲子时光,1106744670,Jpt583375127,5.0,3
179,宜宾,,打斗场面非常的精彩。看到了中国功夫非常的好。发扬我们中国功夫。年轻人的爱情，曲折，好看,1106671903,lKm692325088,5.0,2
180,株洲,,很不错的一部电影，很喜欢,1107610909,千山易雪,5.0,1
181,上海,2,木兰辞是我喜欢的我国传统文化，木兰也是我喜欢的人物支持这波弘扬我国传统英雄女性的电影~,1107638155,Pjr220858137,5.0,2
182,泰州,,故事情节很精彩，电影幽默，陪着孩子一起看。剧情很有意思，孩子看的聚精会神,1107637146,mpV570999797,5.0,1
183,泉州,2,从小就看花木兰，太期待这部电影了！！！,1107594690,uvB253818643,5.0,2
184,泰州,1,以动画形式还原中国木兰的精气神，对花木兰这个巾帼英雄的成长描述的很好，值得一看。,1107638105,Uie276699631,5.0,4
185,济宁,,除了剧情俗套，特效个别不好，其它还可以,1107628920,培培,4.0,1
186,长治,1,支持国漫，支持李斯丹妮！王子因为害怕木兰的女儿身份暴露就进军长城。人物造型以及整体构思都不错。,1106660386,相守哥哥,5.0,2
187,成都,,成都没有排片么,1107633224,GSz374159286,0.0,2
188,海伦市,2,走心、尊重观众的电影创作，但不是那么完美，一千个人有一千个看法,1107622883,明月8933,5.0,2
189,东莞,2,非常能代表中国特色的一部好电影，真值得一看,1107617307,hSD824045087,5.0,1
190,哈尔滨,1,这个电影非常好，很有中国特色，推荐大家去电影院观看,1107611909,爱情旋旋感鹏哥,5.0,3
191,成都,,电影剧情还不错了，画面感也很好，特别喜欢花木兰了，值得看看了！,1107607816,阳光19862007,5.0,2
192,武汉,,这是全球首次以三维动画形式讲述花木兰故事。木兰作为军中出了名的“刺头”，比身边的男人更蛮更横，虽然武艺高强02，但从也看出木兰的坚毅，果断。一次次的阴谋，没有打败木兰，她是巾帼英雄。,1107607637,想自由li,5.0,2
193,长治,1,《木兰横空出世》整体感觉还不错，电影风格风趣幽默，画面唯美，故事情节也都很棒，支持国漫！！！,1106775508,「韩、XW」,5.0,1
194,柳州,,国庆了终于有空带孩子看电影了 首选当然是花木兰 期待已久 小朋友很开心,1106642116,KTu287815308,5.0,2
195,武汉,,看着花木兰的一路成长，也希望身边的孩子能感受到木兰替父从军，保家卫国的英雄精神。,1107600785,说说eryi,5.0,1
196,泸州,,"很不错 适合全家一起看 小朋友非常喜欢哦
要跟木兰一样做个真公主94",1106683236,uNT375154311,5.0,2
197,泸州,,小时候的童年女英雄木兰 也带女儿一起看 希望也能在她心中种下独立 勇敢的种子,1106665084,jyiry,5.0,3
198,枣庄,1,电影场景宏大，镜头场景切换不错，作画水平优秀，是适合重温花木兰故事的不二之选，影响力也十分大，我身边的人也都观看了这个电影，相当不错,1106813665,秋濑470,5.0,1
199,成都,1,谁能告诉我，为什么明明上映了，却没有地方能看,1107604124,insist4d,0.0,2
200,沈阳,1,特别喜欢这个电影，看完之后热血澎湃。木兰英姿飒爽的身影非常喜欢，希望可以看到第二部。,1106825635,街风607,5.0,1
201,青岛,,这部电影非常好看，是我最近看的最好的一部电影，内容十分紧凑，我非常喜欢。,1106847148,简一,5.0,1
202,青岛,,这部国漫太好看啦！！！谁说女子不如男！！巾帼不让须眉！！,1106846182,94,5.0,1
203,蚌埠,,木兰彰显的木兰精神，真的太让人感动，木兰故事从课本里知道，理解颇深。,1107601415,大大利大大,5.0,2
204,青岛,1,"山水画的底色，十分优美动人，中国式的风格，映照不一样的英雄木兰，祝票房大卖
",1107590036,醋味柠檬,5.0,2
