,旅游者类型,昵称,时间,日期
94,独自旅游,海洋主义,2015-05-10,"现场很震撼, 声光电结合的很不错, 演员大多是外籍的, 表演得很敬业, 就是门票实在是贵了些"
95,独自旅游,my00,2015-04-16,"好看, 广州长隆国际马戏大剧院, 相当不错的表演, 仿佛进到童话世界, 小时候童话故事的梦"
96,独自旅游,童找找,2015-04-16,"很精彩, 特别是后面几个节目, 一定要坐前面哦, 身临其境, 有短驳车接送, 长隆酒店走过去, 分钟"
97,独自旅游,zxcic,2015-04-07,"提前两天预定了, 张广州长隆国际马戏大剧院套票, 白虎餐厅自助餐, 大马戏, 化了, 元, 结果到了取票地点必须在自助取票机上取票, 第一次弄, 也没有人指导, 手机短信翻了半天找不到订票号, 酒店说不能人工给票, 叫来服务员帮忙看短信, 打电话, 语音接听老半天, 折腾了近一个小时才搞定, 结果, 多元的自助餐只剩下, 分钟不到, 只能匆匆填了肚子赶紧看马戏, 还没地儿开发票, 真是哭笑不得"
98,独自旅游,E10****34,2015-03-21,"现场看这些杂技和马戏表扬还是很震撼的, 灯光效果也不错, 值得推荐"
99,独自旅游,浪里个浪狼,2015-01-31,"节目不错, 设施, 整体感觉还行, 挺热闹的, 当天人气不足, 整个场地坐不满三分之一, 感觉有点对不住台上演员的卖力演出呀"
100,独自旅游,JimmyLuMR,2015-01-29,"表演总体还行, 个小时的表演, 人和动物的互动都十分的和谐, 也有不少的惊险表演"
101,独自旅游,you****yu,2015-01-27,"马戏还是挺好看的, 各种表演非常刺激, 花样也很多, 看得出来是大制作, 就是票价太贵了, 比一场电影贵五六倍的价格"
102,独自旅游,清风明月9888,2015-01-10,"真不错, 现场与电视有本质的区别, 不虚此行"
103,独自旅游,189****2846,2014-12-13,"非常值得一去的地方, 相当的精彩, 让人看完处于激动之中, 太精彩太漂亮了, 一定要去看看"
104,独自旅游,_cft01****7317194,2014-12-10,"这大马戏真不愧是国际大马戏, 超赞的, 非常非常的精彩, 是我看过最精彩的马戏, 推荐看看"
105,独自旅游,游游MVP,2014-12-07,"非常精彩, 不愧是国际表演, 孩子看得非常开心跟兴奋, 灯光到位表演到位, 会推荐朋友们来观看, 小朋友也要门票哦, 不管多大都要, 这样就有点不划算"
106,独自旅游,千渡,2014-11-29,"和朋友专门过来看到这里的演出, 是非常好的, 灯光, 效果是非常好的, 音响效果也是不错, 门票不是很贵"
107,独自旅游,_cs33****3071,2014-11-23,"从国外进口高科技焰火, 可以随音乐不断变幻造型, 小孩子有几次都忍不住叫了起来, 演员表演认真很是敬业"
108,独自旅游,cd****ei,2014-11-07,"非常精彩的表演, 非常震撼, 表演内容以杂技为主, 演员们很敬业, 让人情不自禁地为他们鼓掌, 一开始就有一个人从顶下直落入水中, 又有火焰又有水花, 尤其赞的是, 在节目间隙也不会冷场, 会有小丑啊, 舞蹈演员啊来和观众互动, 光影和舞台效果配合极好, 确是一场视觉盛宴"
109,独自旅游,m981119,2014-10-15,"马戏真的很好看精彩, 人演的杂技较多, 动物表演的马戏较少, 一定要早点去, 占个好位置"
110,独自旅游,_时光不老,2014-09-21,"这里的动物表演很精彩, 票价自然也不便宜, 但是感觉还是值得的, 因为舞台美轮美奂, 灯光效果配合的相得益彰, 动物们的表演非常精彩, 让人看得目不暇接, 值得一看"
111,独自旅游,曦雪,2014-09-14,"果然名不虚传, 非常值得一看, 舞台灯光, 演员表演都让大家眼前一亮, 后面的节目危险性就大多了, 刺激多了"
112,独自旅游,_yt1****866,2014-08-31,"非常棒的马戏表演, 动物种类非常多, 主要是特技演员高超的高空科技和现场道具的配合非常值得观看"
113,独自旅游,维亚达纳张,2014-08-27,"广州长隆的国际马戏大剧院的马戏表演非常太精彩, 每个节目衔接很好表演也精彩, 每个节目也都很惊险刺激, 表演者很敬业, 舞台设计和灯光很漂亮"
114,独自旅游,爱长肉的小姐姐,2014-08-24,"值得一看, 节目惊险并有趣味性, 大人小孩都可以看"
115,独自旅游,159****2000,2014-08-24,"场景很唯美, 表演惊险, 刺激, 震撼, 就是去的时候下大雨, 所有人在外面淋湿透工作人员一点不人性化, 也不开始检票先进去"
116,独自旅游,shandan,2014-08-12,"不愧是国际大马戏, 演出很精彩, 气氛很热烈, 虽然门票高点, 但值得一看"
117,独自旅游,_gf406****130051,2014-08-11,"零几年的时候就看过一次, 非常震撼, 国外演员表现力强, 很有观赏性, 去的人一定早点儿啊, 去的晚只能坐到很偏的位置, 会影响整体观看效果的"
118,独自旅游,M93****48,2014-07-18,"强烈建议大家去看, 广州的警察帅气态度好, 可以沿路的问, 位置很好找, 带小孩和老人出游不错的选择"
119,独自旅游,streetguest,2014-07-14,"算是国内首屈一指的马戏表演, 旺季一定要提前订票, 否则后果自负, 吐嘈一下大马戏的门票, 这些年从, 块涨到了, 倍多啊"
120,独自旅游,E39****03,2014-07-02,"很好的, 很好的, 很好的, 很好的, 很好的, 很好的"
121,独自旅游,m83****85,2014-06-23,"头一次看到这么好的现场表演节目, 舞台布景, 灯光, 音响效果都是一流, 外国人表演的节目很有异域风情"
122,独自旅游,130****8510,2014-06-06,"长隆大马戏, 表演很精彩, 环球飞车, 还有搞笑的跳水杂技表演, 有互动, 很好玩"
123,独自旅游,nonono_ustc,2014-06-04,"很值得, 很大的地方, 跟电视上那种大表演一样的, 现场的感觉截然不同, 大人小孩都很开心, 非常适合朋友和家庭出游, 能住在园里就更好"
124,独自旅游,E29****74,2014-05-29,"白天先去鳄鱼公园看到很多漂亮的动物还有凶猛的鳄鱼表演, 下午, 点多就到大马戏看表演"
125,独自旅游,快乐天使888,2014-05-28,"年去看过一次大马戏, 好像那时候是, 元吧, 现在涨了好多了, 非常精彩, 坐前排说不定还能抢到小玩意, 音响效果很好, 很震撼, 演员大部分是国外来的, 好专业, 喜欢, 赞"
126,商务,享受生活2013,2016-03-13,"剧院演出的大马戏名气很大, 演员来自境外的居多, 而且货真价实, 剧场很大, 能容纳将近万人, 据说是世界上最大的马戏场, 座位不需要对号, 当然, 票除外, 因此要想从最理想的角度去欣赏马戏, 显然是越早入场越好, 演出是晚上, 开始, 每天都有, 剧场灯光效果很好, 舞美设计也不错, 注意, 拍照时一定不要用闪光灯"
127,商务,_BAID****5341,2017-04-22,"精美的舞台, 早早来占座, 两个小时的等待不觉得无聊, 大屏幕有演员介绍和长隆各个景点介绍"
128,商务,_wb1****082,2015-07-11,"门票三百, 但是物超所值了, 很多看的玩的了"
129,商务,acay,2014-07-27,"如果来到长隆欢乐世界, 不进马戏团就可惜了, 个人觉得来长隆必进的就是欢乐世界和大马戏了, 很赞"
130,商务,leohf,2014-06-18,"长隆国际大马戏非常精彩, 具有国际一流水准"
131,好友,M10****940,2015-05-16,"地铁, 口出, 过了天桥园区有免费大巴直接到马戏团门口, 尽量提前一个小时以上, 位置会好些, 绝对是值了, 舞台灯光效果赞, 传统的狮子老虎狗熊秋千圆环上下都有, 包装很好, 复古大气趣味刺激等等, 每样都有, 不过毕竟马戏团经典项目大概都是那些, 所以适合初次观看, 一辈子起码也该看一次, 马达加斯加, 里的熊骑摩托车也有"
132,好友,138****8531,2015-08-27,"非常精彩的演出, 来长隆不看这个觉得那肯定是会留有遗憾的, 散场后都意犹未尽哇, 编排的很有新, 节目内容也很丰富"
133,好友,规格高,2015-04-24,"对于票价和所表演的时间来对比, 票价太高, 表演太少, 适合城里小孩看, 也适合没见过动物需要学习动物的人去看, 对于动物保护者来讲, 这个不应该在有, 让动物回归本真吧"
134,好友,游游女神,2014-11-22,"就如标题所言, 不是什么马戏, 就是杂技, 所谓马戏就是, 一段时间后, 一些动物走个过场, 杂技内容来说, 没有一个够得上春晚的资格, 不算国内或来国内表演的最好的杂技团, 也就省级水平, 相对国庆票价就不值了, 骗骗没见过世面的"
135,好友,爱上717,2014-11-08,"大剧院拥有全球最大的专业马戏表演场, 能够接待, 名观众同时观看演出, 还是不错的地方, 值得推荐一下"
136,好友,上海音然,2014-10-23,"一个场面宏大的演出, 实景式的森林, 小山, 溪流, 小船, 动物与众多森林精灵交相辉映, 绝对会让你有一种耳目一新的奇妙体验"
137,好友,M12****339,2014-10-21,"很精彩的杂技表演, 每个表演都让人鼓掌尖叫, 不过动物的表演相对来说太少了点, 很不错"
138,好友,新鑫123,2014-10-16,"拥有世界最大的森林实景式舞台布置, 新版舞台模式突破了传统舞台的极限, 表演也很精彩, 推荐一下"
139,好友,136****4230,2014-10-13,"新版舞台模式突破了传统舞台的极限, 与众多森林精灵交相辉映, 绝对会让你有一种耳目一新的奇妙体验"
140,好友,Doriangelhu,2014-08-08,"马戏表演太精彩了, 紧邻市区, 交通方便, 下班过去看完马戏还有时间去吃夜宵, 实在太棒了"
141,好友,i游走的虎,2014-07-03,"这么大的马戏演出场所实在是令人不可思议, 来自世界各地的表演者为观众奉献了一场无与伦比的精彩演出, 紧张, 刺激但绝对妙不可言, 难得的, 秀, 令人难忘"
142,好友,i游走的虎,2014-07-03,"这么大的马戏演出场所实在是令人不可思议, 来自世界各地的表演者为观众奉献了一场无与伦比的精彩演出, 紧张, 刺激但绝对妙不可言, 难得的, 秀, 令人难忘"
143,好友,i游走的虎,2014-07-03,"这么大的马戏演出场所实在是令人不可思议, 来自世界各地的表演者为观众奉献了一场无与伦比的精彩演出, 紧张, 刺激但绝对妙不可言, 难得的, 秀, 令人难忘"
144,好友,i游走的虎,2014-07-03,"这么大的马戏演出场所实在是令人不可思议, 来自世界各地的表演者为观众奉献了一场无与伦比的精彩演出, 紧张, 刺激但绝对妙不可言, 难得的, 秀, 令人难忘"
