,旅行者类型,昵称,地区,时间,标题,评论
61,好友,huanghill,中国,2016年5月7日,"刺激, 爽","和朋友一起过来, 人很多, 有些项目要排好久的队, 这样好浪费时间啊, 不过我还是登上了十环过山车, 这次还是值了, 一开始还想着以什么姿势来惊叫, 怎么知道风的阻力太大, 以致我头都抬不起来, 哭死, 唯一的后遗症就是我下地的时候脚飘飘的, 这酸爽, 不过好像只有我有这种感觉, 朋友都不会, 来玩一定要做好防晒工作, 穿双平底鞋, 带把伞, 这样你在排队的时候会舒服点"
62,好友,kenyellow,977,2016年3月22日,刺激,"十环过山车, 垂直过山车, 大摆锤, 哪个是长隆最刺激的项目, 都不是, 长隆最刺激的项目肯定是排队, 建议尽量不要在节假日去, 太多人了, 一天下来可以玩不了几个项目, 平心而论, 长隆欢乐世界的机动游戏算是很不错的, 个人认为比迪士尼的强"
63,好友,Jet55910092190,广东省广州市,2016年2月23日,刺激寻觅者的爱好圣地,"从汉溪长隆地铁站步行过去大概, 分钟左右, 交通非常方便, 园区大, 人流量也多, 大概因为节假日原因, 每玩一个项目大概都需要, 分钟的排队时间, 随处都可以听见尖叫声, 除了大量的机动游戏, 还有, 电影, 十分精彩, 园区的食品价格是外面的, 倍, 重点是还不许带食物入内"
64,好友,DayTrip56502043996,广东省中山市,2016年2月15日,机动游戏,"我们那天去的比较早, 人不是很多, 没有怎么排队, 我们第一个玩的就是那个垂直过山车, 真的是好刺激, 下来腿都有点软软的, 后面那个, 型滑板和那个大摆锤都不敢再玩, 只玩了那些没有那么刺激的项目, 到后来人越来越多, 几乎都是在排队, 差不多是排大半个小时玩两分钟, 很好玩明年再过来"
65,好友,JankoWong,广东省广州市,2016年1月23日,广州的主题乐园,"长隆集团拥有欢乐世界, 大马戏, 野生动物世界等, 欢乐世界以机动游戏为主, 一定要玩垂直过山车, 但是一到周末会比较多人, 建议早点去, 与香港海洋公园相比还是有一定差距"
66,好友,Tour17931858295,广东省广州市,2015年11月14日,"挺好玩的, 大人和小孩都可以去","以前和朋友去, 次过, 也在那做过一段时间兼职, 小朋友比较适合到哈比王国玩, 如果小朋友想坐过山车的话, 可以选择坐飞马家庭过山车, 想玩刺激点的朋友, 可以选择去尖叫地带和彩虹湾, 玩八大之最中的垂直过山车, 十环过山车和摩托过山车, 一定要挑非节假日, 不然会很多人, 非节假去玩的话, 人比较, 少多数不用排队, 我个人觉得里面卖的吃都挺贵的, 一条热狗大概, 元左右"
67,好友,phyllislin2015,广东省佛山市,2015年11月6日,"超好玩, 大赞","激动游戏特别多, 而且都比较新, 跟来自远方的朋友玩的不亦乐乎, 除了人多一点以外也就没什么好抱怨的了, 对了, 最好自己带些吃的进去, 不然里面吃的消费还是蛮高的"
68,好友,mmeko,广东省广州市,2015年10月28日,欢乐世界,"是长隆集团的一个园子, 跟动物园水上世界是在一起的, 各个园子都有接驳车, 里面都是玩电动项目, 跟男就在里面拍过, 有很多项目还是很刺激"
69,好友,sabrinaroth616,广东省广州市,2015年9月16日,爽,"这里的机动游戏可以说是很多地方都无法比拟的, 来广州一定要来这里玩一次机动游戏, 所有烦恼烟飞云散, 而且这里还有好多好多的其他可以玩, 什么水上乐园, 动物园, 好多"
70,好友,iihao,广东省广州市,2015年9月7日,新奇好玩,"欢乐世界有很多机动游戏, 新奇刺激, 节假日太多人, 里面的餐饮很贵, 可以自己带点干粮进去, 十环过山车, 垂直过山车和大摆锤是必玩项目, 真的很刺激, 激流勇进溅起的水花超级大, 好玩, 还有, 电影, 很好玩, 可以去体验, 还有一些现场表演都很不错的, 至少可以玩足一整天"
71,好友,kamonl,广东省佛山市,2015年7月16日,"好玩, 刺激, 爽歪歪","长隆欢乐世界在番禺区, 从欢乐世界正门的地铁口步行过去大概, 分钟左右, 交通非常方便, 这里相对深圳欢乐谷, 长隆欢乐谷的设施还算不错的, 园区都是超大的, 不过人数太多了, 玩一个大型的机动项目基本都要, 分钟, 里面的十环过山车很爽歪歪哦, 就是园区不准带食物, 园区的食物, 水是外面的, 倍, 总体来说还是不错了"
72,好友,258908705Nancy,4,2015年4月20日,相对来说比较刺激,"那里的刺激项目基本都玩过了, 提醒各位最好不要玩, 型滑板, 我可以坐几次十环几次大摆锤, 几次垂直, 但我坐一次, 型滑板就感觉不舒服"
73,好友,Nomad06242904497,广东省广州市,2015年1月21日,好好玩的地方,"周末的时候和朋友一起去玩的, 还好人不是很多, 玩的项目也还是蛮多的, 上午一直玩到下午才出来, 票价, 多, 感觉还是值得去的"
